"Authors","Author full names","Author(s) ID","Title","Year","Source title","Volume","Issue","Art. No.","Page start","Page end","Page count","Cited by","DOI","Link","Document Type","Publication Stage","Open Access","Source","EID"
"Ioannou A.; Patel R.K.; Martinez-Naharro A.; Razvi Y.; Porcari A.; Rauf M.U.; Bolhuis R.E.; Fernando-Sayers J.; Virsinskaite R.; Bandera F.; Kotecha T.; Venneri L.; Knight D.; Manisty C.; Moon J.; Lachmann H.; Whelan C.; Kellman P.; Hawkins P.N.; Gillmore J.D.; Wechalekar A.; Fontana M.","Ioannou, Adam (57188664278); Patel, Rishi K. (57210156635); Martinez-Naharro, Ana (55343433500); Razvi, Yousuf (57219044558); Porcari, Aldostefano (57201271007); Rauf, Muhammad U. (57985713000); Bolhuis, Roos E. (58539470600); Fernando-Sayers, Jacob (58576411500); Virsinskaite, Ruta (58539561200); Bandera, Francesco (55325767500); Kotecha, Tushar (38661453500); Venneri, Lucia (6506276972); Knight, Daniel (55589453200); Manisty, Charlotte (6504025861); Moon, James (57202314649); Lachmann, Helen (7004915734); Whelan, Carol (36647033100); Kellman, Peter (7004851504); Hawkins, Philip N. (35464959200); Gillmore, Julian D. (7003539031); Wechalekar, Ashutosh (6506002568); Fontana, Marianna (16306839900)","57188664278; 57210156635; 55343433500; 57219044558; 57201271007; 57985713000; 58539470600; 58576411500; 58539561200; 55325767500; 38661453500; 6506276972; 55589453200; 6504025861; 57202314649; 7004915734; 36647033100; 7004851504; 35464959200; 7003539031; 6506002568; 16306839900","Tracking Treatment Response in Cardiac Light-Chain Amyloidosis with Native T1 Mapping","2023","JAMA Cardiology","8","9","","848","852","4","23","10.1001/jamacardio.2023.2010","https://www.scopus.com/inward/record.uri?eid=2-s2.0-85171203437&doi=10.1001%2fjamacardio.2023.2010&partnerID=40&md5=74e0af57674b735d401581629591fc9b","Article","Final","All Open Access; Green Open Access; Hybrid Gold Open Access","Scopus","2-s2.0-85171203437"
"Brown J.T.; Kotecha T.; Steeden J.A.; Fontana M.; Denton C.P.; Coghlan J.G.; Knight D.S.; Muthurangu V.","Brown, James T. (57212760167); Kotecha, Tushar (38661453500); Steeden, Jennifer A. (36605240600); Fontana, Marianna (16306839900); Denton, Christopher P. (7006031021); Coghlan, J. Gerry (35393553500); Knight, Daniel S. (55589453200); Muthurangu, Vivek (7801671480)","57212760167; 38661453500; 36605240600; 16306839900; 7006031021; 35393553500; 55589453200; 7801671480","Reduced exercise capacity in patients with systemic sclerosis is associated with lower peak tissue oxygen extraction: a cardiovascular magnetic resonance-augmented cardiopulmonary exercise study","2021","Journal of Cardiovascular Magnetic Resonance","23","1","118","","","","13","10.1186/s12968-021-00817-1","https://www.scopus.com/inward/record.uri?eid=2-s2.0-85117961458&doi=10.1186%2fs12968-021-00817-1&partnerID=40&md5=52ae76cb6c27a01924a46ddaa5ab786f","Article","Final","All Open Access; Gold Open Access; Green Open Access","Scopus","2-s2.0-85117961458"
"Jiang Y.; Punjabi K.; Pierce I.; Knight D.; Yao T.; Steeden J.; Hughes A.D.; Muthurangu V.; Davies R.","Jiang, Yue (58681466100); Punjabi, Karan (57392659400); Pierce, Iain (57224133548); Knight, Daniel (55589453200); Yao, Tina (58161103900); Steeden, Jennifer (36605240600); Hughes, Alun D. (57207789660); Muthurangu, Vivek (7801671480); Davies, Rhodri (57198821565)","58681466100; 57392659400; 57224133548; 55589453200; 58161103900; 36605240600; 57207789660; 7801671480; 57198821565","A machine learning algorithm for creating isotropic 3D aortic segmentations from routine cardiac MR localizers","2025","Magnetic Resonance Imaging","115","","110253","","","","1","10.1016/j.mri.2024.110253","https://www.scopus.com/inward/record.uri?eid=2-s2.0-85206809915&doi=10.1016%2fj.mri.2024.110253&partnerID=40&md5=7298b2d8ddaad6ef488f06ec0cf7bfd6","Article","Final","All Open Access; Hybrid Gold Open Access","Scopus","2-s2.0-85206809915"
"Hausenloy D.J.; Lim M.X.; Chan M.H.H.; Paradies V.; Francis R.; Kotecha T.; Knight D.S.; Fontana M.; Kellman P.; Moon J.C.; Bulluck H.","Hausenloy, Derek J. (6602976997); Lim, Mei Xing (57194778025); Chan, Mervyn H. H. (57202460937); Paradies, Valeria (26431508400); Francis, Rohin (57194779300); Kotecha, Tushar (38661453500); Knight, Daniel S. (55589453200); Fontana, Marianna (16306839900); Kellman, Peter (7004851504); Moon, James C. (57202314649); Bulluck, Heerajnarain (53981151600)","6602976997; 57194778025; 57202460937; 26431508400; 57194779300; 38661453500; 55589453200; 16306839900; 7004851504; 57202314649; 53981151600","Interrogation of the infarcted and salvaged myocardium using multi-parametric mapping cardiovascular magnetic resonance in reperfused ST-segment elevation myocardial infarction patients","2019","Scientific Reports","9","1","9056","","","","2","10.1038/s41598-019-45449-9","https://www.scopus.com/inward/record.uri?eid=2-s2.0-85067792100&doi=10.1038%2fs41598-019-45449-9&partnerID=40&md5=92f9e28477b50151cf84b1affc982b59","Article","Final","All Open Access; Gold Open Access; Green Open Access","Scopus","2-s2.0-85067792100"
"Thornton G.D.; Shetye A.; Knight D.S.; Knott K.; Artico J.; Kurdi H.; Yousef S.; Antonakaki D.; Razvi Y.; Chacko L.; Brown J.; Patel R.; Vimalesvaran K.; Seraphim A.; Davies R.; Xue H.; Kotecha T.; Bell R.; Manisty C.; Cole G.D.; Moon J.C.; Kellman P.; Fontana M.; Treibel T.A.","Thornton, George D. (57204675230); Shetye, Abhishek (57189903814); Knight, Dan S. (55589453200); Knott, Kris (57202865988); Artico, Jessica (57188622189); Kurdi, Hibba (57193681633); Yousef, Souhad (57395339700); Antonakaki, Dimitra (57093972300); Razvi, Yousuf (57219044558); Chacko, Liza (57210256202); Brown, James (57212760167); Patel, Rishi (57210156635); Vimalesvaran, Kavitha (55625550800); Seraphim, Andreas (26535098000); Davies, Rhodri (57198821565); Xue, Hui (52365249300); Kotecha, Tushar (38661453500); Bell, Robert (57213808377); Manisty, Charlotte (6504025861); Cole, Graham D. (36623430500); Moon, James C. (57202314649); Kellman, Peter (7004851504); Fontana, Marianna (16306839900); Treibel, Thomas A. (15754511800)","57204675230; 57189903814; 55589453200; 57202865988; 57188622189; 57193681633; 57395339700; 57093972300; 57219044558; 57210256202; 57212760167; 57210156635; 55625550800; 26535098000; 57198821565; 52365249300; 38661453500; 57213808377; 6504025861; 36623430500; 57202314649; 7004851504; 16306839900; 15754511800","Myocardial Perfusion Imaging After Severe COVID-19 Infection Demonstrates Regional Ischemia Rather Than Global Blood Flow Reduction","2021","Frontiers in Cardiovascular Medicine","8","","764599","","","","18","10.3389/fcvm.2021.764599","https://www.scopus.com/inward/record.uri?eid=2-s2.0-85133418407&doi=10.3389%2ffcvm.2021.764599&partnerID=40&md5=2321a5618851839b506b3763d02c86b3","Article","Final","All Open Access; Gold Open Access; Green Open Access","Scopus","2-s2.0-85133418407"
"Brown J.T.; Virsinskaite R.; Kotecha T.; Steeden J.A.; Fontana M.; Karia N.; Schreiber B.E.; Ong V.H.; Denton C.P.; Coghlan J.G.; Muthurangu V.; Knight D.S.","Brown, James T. (57212760167); Virsinskaite, Ruta (58539561200); Kotecha, Tushar (38661453500); Steeden, Jennifer A. (36605240600); Fontana, Marianna (16306839900); Karia, Nina (37122124800); Schreiber, Benjamin E. (36106322600); Ong, Voon H (8398311200); Denton, Christopher P. (7006031021); Coghlan, J. Gerry (35393553500); Muthurangu, Vivek (7801671480); Knight, Daniel S. (55589453200)","57212760167; 58539561200; 38661453500; 36605240600; 16306839900; 37122124800; 36106322600; 8398311200; 7006031021; 35393553500; 7801671480; 55589453200","Prognostic utility of exercise cardiovascular magnetic resonance in patients with systemic sclerosis-associated pulmonary arterial hypertension","2024","European Heart Journal Cardiovascular Imaging","25","12","","1712","1720","8","2","10.1093/ehjci/jeae177","https://www.scopus.com/inward/record.uri?eid=2-s2.0-85210902913&doi=10.1093%2fehjci%2fjeae177&partnerID=40&md5=be3f3a446de072c720d995e07a0ed9c8","Article","Final","All Open Access; Green Open Access; Hybrid Gold Open Access","Scopus","2-s2.0-85210902913"
"Kotecha T.; Monteagudo J.M.; Martinez-Naharro A.; Chacko L.; Brown J.; Knight D.; Knott K.D.; Hawkins P.; Moon J.C.; Plein S.; Xue H.; Kellman P.; Lockie T.; Patel N.; Rakhit R.; Fontana M.","Kotecha, Tushar (38661453500); Monteagudo, Juan Manuel (57194274773); Martinez-Naharro, Ana (55343433500); Chacko, Liza (57210256202); Brown, James (57212760167); Knight, Daniel (55589453200); Knott, Kristopher D. (57202865988); Hawkins, Philip (35464959200); Moon, James C. (57202314649); Plein, Sven (6701840061); Xue, Hui (52365249300); Kellman, Peter (7004851504); Lockie, Tim (16230845400); Patel, Niket (55618205500); Rakhit, Roby (6603035925); Fontana, Marianna (16306839900)","38661453500; 57194274773; 55343433500; 57210256202; 57212760167; 55589453200; 57202865988; 35464959200; 57202314649; 6701840061; 52365249300; 7004851504; 16230845400; 55618205500; 6603035925; 16306839900","Quantitative cardiovascular magnetic resonance myocardial perfusion mapping to assess hyperaemic response to adenosine stress","2021","European Heart Journal Cardiovascular Imaging","22","3","","273","281","8","20","10.1093/ehjci/jeaa252","https://www.scopus.com/inward/record.uri?eid=2-s2.0-85099969250&doi=10.1093%2fehjci%2fjeaa252&partnerID=40&md5=1585538050450b1213b21ada5fba0512","Article","Final","All Open Access; Bronze Open Access; Green Open Access","Scopus","2-s2.0-85099969250"
"Porcari A.; Masi A.; Martinez-Naharro A.; Razvi Y.; Patel R.; Ioannou A.; Rauf M.U.; Sinigiani G.; Wisniowski B.; Filisetti S.; Currie-Cathey J.; O'Beara S.; Kotecha T.; Knight D.; Moon J.C.; Sinagra G.; Virsinskaite R.; Gilbertson J.; Venneri L.; Petrie A.; Lachmann H.; Whelan C.; Kellman P.; Ravichandran S.; Cohen O.; Mahmood S.; Manisty C.; Hawkins P.N.; Gillmore J.D.; Wechalekar A.D.; Fontana M.","Porcari, Aldostefano (57201271007); Masi, Ambra (57718446200); Martinez-Naharro, Ana (55343433500); Razvi, Yousuf (57219044558); Patel, Rishi (57210156635); Ioannou, Adam (57188664278); Rauf, Muhammad U. (57985713000); Sinigiani, Giulio (57220762360); Wisniowski, Brendan (43462252700); Filisetti, Stefano (58539537900); Currie-Cathey, Jasmine (57882074500); O'Beara, Sophie (57987073900); Kotecha, Tushar (38661453500); Knight, Dan (55589453200); Moon, James C. (57202314649); Sinagra, Gianfranco (7005062509); Virsinskaite, Ruta (58539561200); Gilbertson, Janet (7005657127); Venneri, Lucia (6506276972); Petrie, Aviva (35974110300); Lachmann, Helen (7004915734); Whelan, Carol (36647033100); Kellman, Peter (7004851504); Ravichandran, Sriram (57216583258); Cohen, Oliver (57213043500); Mahmood, Shameem (50361564300); Manisty, Charlotte (6504025861); Hawkins, Philip N. (35464959200); Gillmore, Julian D. (7003539031); Wechalekar, Ashutosh D. (6506002568); Fontana, Marianna (16306839900)","57201271007; 57718446200; 55343433500; 57219044558; 57210156635; 57188664278; 57985713000; 57220762360; 43462252700; 58539537900; 57882074500; 57987073900; 38661453500; 55589453200; 57202314649; 7005062509; 58539561200; 7005657127; 6506276972; 35974110300; 7004915734; 36647033100; 7004851504; 57216583258; 57213043500; 50361564300; 6504025861; 35464959200; 7003539031; 6506002568; 16306839900","Redefining Cardiac Involvement and Targets of Treatment in Systemic Immunoglobulin AL Amyloidosis","2024","JAMA Cardiology","9","11","","982","989","7","6","10.1001/jamacardio.2024.2555","https://www.scopus.com/inward/record.uri?eid=2-s2.0-85209069542&doi=10.1001%2fjamacardio.2024.2555&partnerID=40&md5=2733f938e1f21018b5515dc3777c26fb","Article","Final","All Open Access; Hybrid Gold Open Access","Scopus","2-s2.0-85209069542"
"Kotecha T.; Chacko L.; Chehab O.; O'Reilly N.; Martinez-Naharro A.; Lazari J.; Knott K.D.; Brown J.; Knight D.; Muthurangu V.; Hawkins P.; Plein S.; Moon J.C.; Xue H.; Kellman P.; Rakhit R.; Patel N.; Fontana M.","Kotecha, Tushar (38661453500); Chacko, Liza (57210256202); Chehab, Omar (57194512078); O'Reilly, Nanci (57208274847); Martinez-Naharro, Ana (55343433500); Lazari, Jonathan (57204354738); Knott, Kristopher D. (57202865988); Brown, James (57212760167); Knight, Daniel (55589453200); Muthurangu, Vivek (7801671480); Hawkins, Philip (35464959200); Plein, Sven (6701840061); Moon, James C. (57202314649); Xue, Hui (52365249300); Kellman, Peter (7004851504); Rakhit, Roby (6603035925); Patel, Niket (55618205500); Fontana, Marianna (16306839900)","38661453500; 57210256202; 57194512078; 57208274847; 55343433500; 57204354738; 57202865988; 57212760167; 55589453200; 7801671480; 35464959200; 6701840061; 57202314649; 52365249300; 7004851504; 6603035925; 55618205500; 16306839900","Assessment of Multivessel Coronary Artery Disease Using Cardiovascular Magnetic Resonance Pixelwise Quantitative Perfusion Mapping","2020","JACC: Cardiovascular Imaging","13","12","","2546","2557","11","53","10.1016/j.jcmg.2020.06.041","https://www.scopus.com/inward/record.uri?eid=2-s2.0-85092663833&doi=10.1016%2fj.jcmg.2020.06.041&partnerID=40&md5=819f8f0b248b2c9ad7df8cd766db7e7d","Article","Final","All Open Access; Bronze Open Access; Green Open Access","Scopus","2-s2.0-85092663833"
"Knight D.S.; Karia N.; Cole A.R.; Maclean R.H.; Brown J.T.; Masi A.; Patel R.K.; Razvi Y.; Chacko L.; Venneri L.; Kotecha T.; Martinez-Naharro A.; Kellman P.; Scott-Russell A.M.; Schreiber B.E.; Ong V.H.; Denton C.P.; Fontana M.; Coghlan J.G.; Muthurangu V.","Knight, Daniel S. (55589453200); Karia, Nina (37122124800); Cole, Alice R. (57235401900); Maclean, Rory H. (57448509700); Brown, James T. (57212760167); Masi, Ambra (57718446200); Patel, Rishi K. (57210156635); Razvi, Yousuf (57219044558); Chacko, Liza (57210256202); Venneri, Lucia (6506276972); Kotecha, Tushar (38661453500); Martinez-Naharro, Ana (55343433500); Kellman, Peter (7004851504); Scott-Russell, Ann M. (24400040100); Schreiber, Benjamin E. (36106322600); Ong, Voon H. (8398311200); Denton, Christopher P. (7006031021); Fontana, Marianna (16306839900); Coghlan, J. Gerry (35393553500); Muthurangu, Vivek (7801671480)","55589453200; 37122124800; 57235401900; 57448509700; 57212760167; 57718446200; 57210156635; 57219044558; 57210256202; 6506276972; 38661453500; 55343433500; 7004851504; 24400040100; 36106322600; 8398311200; 7006031021; 16306839900; 35393553500; 7801671480","Distinct cardiovascular phenotypes are associated with prognosis in systemic sclerosis: a cardiovascular magnetic resonance study","2023","European Heart Journal Cardiovascular Imaging","24","4","","463","471","8","18","10.1093/ehjci/jeac120","https://www.scopus.com/inward/record.uri?eid=2-s2.0-85139938116&doi=10.1093%2fehjci%2fjeac120&partnerID=40&md5=4dd3520023ed4ee6b400def9e711157a","Article","Final","All Open Access; Green Open Access; Hybrid Gold Open Access","Scopus","2-s2.0-85139938116"
"Bulluck H.; Bryant J.A.; Lim M.X.; Tan X.W.; Ramlall M.; Francis R.; Kotecha T.; Cabrera-Fuentes H.A.; Knight D.S.; Fontana M.; Moon J.C.; Hausenloy D.J.","Bulluck, Heerajnarain (53981151600); Bryant, Jennifer A. (57193015222); Lim, Mei Xing (57194778025); Tan, Xiao Wei (57194772103); Ramlall, Manish (56786381300); Francis, Rohin (57194779300); Kotecha, Tushar (38661453500); Cabrera-Fuentes, Hector A. (55322522400); Knight, Daniel S. (55589453200); Fontana, Marianna (16306839900); Moon, James C. (7403231345); Hausenloy, Derek J. (6602976997)","53981151600; 57193015222; 57194778025; 57194772103; 56786381300; 57194779300; 38661453500; 55322522400; 55589453200; 16306839900; 7403231345; 6602976997","Full left ventricular coverage is essential for the accurate quantification of the area-at-risk by T1 and T2 mapping","2017","Scientific Reports","7","1","4871","","","","7","10.1038/s41598-017-05127-0","https://www.scopus.com/inward/record.uri?eid=2-s2.0-85022101593&doi=10.1038%2fs41598-017-05127-0&partnerID=40&md5=cea2c04ff41adf731596cbd3eb4a6f7b","Article","Final","All Open Access; Gold Open Access; Green Open Access","Scopus","2-s2.0-85022101593"
"Chacko L.; Boldrini M.; Martone R.; Law S.; Martinez-Naharrro A.; Hutt D.F.; Kotecha T.; Patel R.K.; Razvi Y.; Rezk T.; Cohen O.C.; Brown J.T.; Srikantharajah M.; Ganesananthan S.; Lane T.; Lachmann H.J.; Wechalekar A.D.; Sachchithanantham S.; Mahmood S.; Whelan C.J.; Knight D.S.; Moon J.C.; Kellman P.; Gillmore J.D.; Hawkins P.N.; Fontana M.","Chacko, Liza (57210256202); Boldrini, Michele (55258660000); Martone, Raffaele (57200571622); Law, Steven (57193713823); Martinez-Naharrro, Ana (55343433500); Hutt, David F. (55985822300); Kotecha, Tushar (38661453500); Patel, Rishi K. (57210156635); Razvi, Yousuf (57219044558); Rezk, Tamer (55985701600); Cohen, Oliver C. (57213043500); Brown, James T. (57212760167); Srikantharajah, Mukunthan (55549519800); Ganesananthan, Sharmananthan (57220863491); Lane, Thirusha (41861760800); Lachmann, Helen J. (7004915734); Wechalekar, Ashutosh D. (6506002568); Sachchithanantham, Sajitha (55621355900); Mahmood, Shameem (50361564300); Whelan, Carol J. (36647033100); Knight, Daniel S. (55589453200); Moon, James C. (57202314649); Kellman, Peter (7004851504); Gillmore, Julian D. (7003539031); Hawkins, Philip N. (35464959200); Fontana, Marianna (16306839900)","57210256202; 55258660000; 57200571622; 57193713823; 55343433500; 55985822300; 38661453500; 57210156635; 57219044558; 55985701600; 57213043500; 57212760167; 55549519800; 57220863491; 41861760800; 7004915734; 6506002568; 55621355900; 50361564300; 36647033100; 55589453200; 57202314649; 7004851504; 7003539031; 35464959200; 16306839900","Cardiac Magnetic Resonance-Derived Extracellular Volume Mapping for the Quantification of Hepatic and Splenic Amyloid","2021","Circulation: Cardiovascular Imaging","14","4","","E012506","","","28","10.1161/CIRCIMAGING.121.012506","https://www.scopus.com/inward/record.uri?eid=2-s2.0-85104859547&doi=10.1161%2fCIRCIMAGING.121.012506&partnerID=40&md5=452f69c61239159710ddf469502bfe1a","Article","Final","All Open Access; Bronze Open Access; Green Open Access","Scopus","2-s2.0-85104859547"
"Gill J.S.; Fontana M.; Knight D.; Kalra S.S.","Gill, Jaspal Singh (55652799900); Fontana, Marianna (16306839900); Knight, Daniel (55589453200); Kalra, Sundeep Singh (46761159400)","55652799900; 16306839900; 55589453200; 46761159400","A case report of eosinophilic granulomatosis and polyangiitis myocarditis presenting as ST elevation myocardial infarction and showing positive response to immunotherapy","2019","European Heart Journal - Case Reports","3","4","","","","","3","10.1093/ehjcr/ytz161","https://www.scopus.com/inward/record.uri?eid=2-s2.0-85079468598&doi=10.1093%2fehjcr%2fytz161&partnerID=40&md5=538668ed80155ce359411634bd4c1726","Article","Final","","Scopus","2-s2.0-85079468598"
"Chacko L.; Kotecha T.; Ioannou A.; Patel N.; Martinez-Naharro A.; Razvi Y.; Patel R.; Massa P.; Venneri L.; Brown J.; Porcari A.; Knott K.; Manisty C.; Knight D.; Lockie T.; Rakhit R.; Lachmann H.; Wechelakar A.; Whelan C.; Ponticos M.; Moon J.; González A.; Gilbertson J.; Riefolo M.; Leone O.; Xue H.; Hawkins P.; Kellman P.; Gillmore J.; Fontana M.","Chacko, Liza (57210256202); Kotecha, Tushar (38661453500); Ioannou, Adam (57188664278); Patel, Niket (55618205500); Martinez-Naharro, Ana (55343433500); Razvi, Yousuf (57219044558); Patel, Rishi (57210156635); Massa, Paolo (57225010842); Venneri, Lucia (6506276972); Brown, James (57212760167); Porcari, Aldostefano (57201271007); Knott, Kristopher (57202865988); Manisty, Charlotte (6504025861); Knight, Daniel (55589453200); Lockie, Tim (16230845400); Rakhit, Roby (6603035925); Lachmann, Helen (7004915734); Wechelakar, Ashutosh (57347924300); Whelan, Carol (36647033100); Ponticos, Markella (6602769002); Moon, James (57202314649); González, Arantxa (57191823224); Gilbertson, Janet (7005657127); Riefolo, Mattia (57200551144); Leone, Ornella (7004143746); Xue, Hui (52365249300); Hawkins, Philip (35464959200); Kellman, Peter (7004851504); Gillmore, Julian (7003539031); Fontana, Marianna (16306839900)","57210256202; 38661453500; 57188664278; 55618205500; 55343433500; 57219044558; 57210156635; 57225010842; 6506276972; 57212760167; 57201271007; 57202865988; 6504025861; 55589453200; 16230845400; 6603035925; 7004915734; 57347924300; 36647033100; 6602769002; 57202314649; 57191823224; 7005657127; 57200551144; 7004143746; 52365249300; 35464959200; 7004851504; 7003539031; 16306839900","Myocardial perfusion in cardiac amyloidosis","2024","European Journal of Heart Failure","26","3","","598","609","11","19","10.1002/ejhf.3137","https://www.scopus.com/inward/record.uri?eid=2-s2.0-85182868443&doi=10.1002%2fejhf.3137&partnerID=40&md5=d7f6072e5baf451f875ddade77ed74df","Article","Final","All Open Access; Hybrid Gold Open Access","Scopus","2-s2.0-85182868443"
"Vreeburg Y.L.; Knight D.S.; Coghlan J.G.; Ong V.H.; Denton C.P.","Vreeburg, Yumiko L (58543970300); Knight, Daniel S (55589453200); Coghlan, John G (35393553500); Ong, Voon H (8398311200); Denton, Christopher P (7006031021)","58543970300; 55589453200; 35393553500; 8398311200; 7006031021","Recurrent episodes of Takotsubo cardiomyopathy in systemic sclerosis","2024","Journal of Scleroderma and Related Disorders","9","1","","NP7","NP11","4","0","10.1177/23971983231188824","https://www.scopus.com/inward/record.uri?eid=2-s2.0-85168440355&doi=10.1177%2f23971983231188824&partnerID=40&md5=f39ea66d8043020d63aefa030714f6dc","Article","Final","All Open Access; Green Open Access","Scopus","2-s2.0-85168440355"
"Kowalik G.T.; Knight D.; Steeden J.A.; Muthurangu V.","Kowalik, Grzegorz Tomasz (6602362169); Knight, Daniel (55589453200); Steeden, Jennifer Anne (36605240600); Muthurangu, Vivek (7801671480)","6602362169; 55589453200; 36605240600; 7801671480","Perturbed spiral real-time phase-contrast MR with compressive sensing reconstruction for assessment of flow in children","2020","Magnetic Resonance in Medicine","83","6","","2077","2091","14","19","10.1002/mrm.28065","https://www.scopus.com/inward/record.uri?eid=2-s2.0-85074830347&doi=10.1002%2fmrm.28065&partnerID=40&md5=f788913c52825b74f837ee2922c3be44","Article","Final","All Open Access; Green Open Access; Hybrid Gold Open Access","Scopus","2-s2.0-85074830347"
"Kotecha T.; Knight D.S.; Razvi Y.; Kumar K.; Vimalesvaran K.; Thornton G.; Patel R.; Chacko L.; Brown J.T.; Coyle C.; Leith D.; Shetye A.; Ariff B.; Bell R.; Captur G.; Coleman M.; Goldring J.; Gopalan D.; Heightman M.; Hillman T.; Howard L.; Jacobs M.; Jeetley P.S.; Kanagaratnam P.; Kon O.M.; Lamb L.E.; Manisty C.H.; Mathurdas P.; Mayet J.; Negus R.; Patel N.; Pierce I.; Russell G.; Wolff A.; Xue H.; Kellman P.; Moon J.C.; Treibel T.A.; Cole G.D.; Fontana M.","Kotecha, Tushar (38661453500); Knight, Daniel S (55589453200); Razvi, Yousuf (57219044558); Kumar, Kartik (55935578800); Vimalesvaran, Kavitha (55625550800); Thornton, George (57204675230); Patel, Rishi (57210156635); Chacko, Liza (57210256202); Brown, James T (57212760167); Coyle, Clare (57204620404); Leith, Donald (58588746800); Shetye, Abhishek (57189903814); Ariff, Ben (6603095428); Bell, Robert (57213808377); Captur, Gabriella (6506837383); Coleman, Meg (57222750076); Goldring, James (25027606200); Gopalan, Deepa (23392407100); Heightman, Melissa (57217978295); Hillman, Toby (55760471200); Howard, Luke (8056207000); Jacobs, Michael (36848322200); Jeetley, Paramjit S (8434302300); Kanagaratnam, Prapa (6603807270); Kon, Onn Min (57189021157); Lamb, Lucy E (18536060000); Manisty, Charlotte H (6504025861); Mathurdas, Palmira (55279735600); Mayet, Jamil (7006017382); Negus, Rupert (6603024058); Patel, Niket (55618205500); Pierce, Iain (57224133548); Russell, Georgina (56328435600); Wolff, Anthony (7102453899); Xue, Hui (52365249300); Kellman, Peter (7004851504); Moon, James C (57202314649); Treibel, Thomas A (15754511800); Cole, Graham D (36623430500); Fontana, Marianna (16306839900)","38661453500; 55589453200; 57219044558; 55935578800; 55625550800; 57204675230; 57210156635; 57210256202; 57212760167; 57204620404; 58588746800; 57189903814; 6603095428; 57213808377; 6506837383; 57222750076; 25027606200; 23392407100; 57217978295; 55760471200; 8056207000; 36848322200; 8434302300; 6603807270; 57189021157; 18536060000; 6504025861; 55279735600; 7006017382; 6603024058; 55618205500; 57224133548; 56328435600; 7102453899; 52365249300; 7004851504; 57202314649; 15754511800; 36623430500; 16306839900","Patterns of myocardial injury in recovered troponin-positive COVID-19 patients assessed by cardiovascular magnetic resonance","2021","European Heart Journal","42","19","","1866","1878","12","300","10.1093/eurheartj/ehab075","https://www.scopus.com/inward/record.uri?eid=2-s2.0-85104107576&doi=10.1093%2feurheartj%2fehab075&partnerID=40&md5=3787b9a3e073d595b10cb155271d71d3","Article","Final","All Open Access; Green Open Access; Hybrid Gold Open Access","Scopus","2-s2.0-85104107576"
