"Authors","Author full names","Author(s) ID","Title","Year","Source title","Volume","Issue","Art. No.","Page start","Page end","Page count","Cited by","DOI","Link","Document Type","Publication Stage","Open Access","Source","EID"
"Knight D.S.; Schwaiger J.P.; Krupickova S.; Davar J.; Muthurangu V.; Coghlan J.G.","Knight, Daniel S. (55589453200); Schwaiger, Johannes P. (14052989000); Krupickova, Sylvia (33667688400); Davar, Joseph (6507903916); Muthurangu, Vivek (7801671480); Coghlan, J. Gerry (35393553500)","55589453200; 14052989000; 33667688400; 6507903916; 7801671480; 35393553500","Accuracy and Test-Retest Reproducibility of Two-Dimensional Knowledge-Based Volumetric Reconstruction of the Right Ventricle in Pulmonary Hypertension","2015","Journal of the American Society of Echocardiography","28","8","","989","998","9","19","10.1016/j.echo.2015.02.020","https://www.scopus.com/inward/record.uri?eid=2-s2.0-84938546753&doi=10.1016%2fj.echo.2015.02.020&partnerID=40&md5=20c88650b95f312dfab748ac06731bc5","Article","Final","All Open Access; Green Open Access; Hybrid Gold Open Access","Scopus","2-s2.0-84938546753"
"Martinez-Naharro A.; Kotecha T.; Norrington K.; Boldrini M.; Rezk T.; Quarta C.; Treibel T.A.; Whelan C.J.; Knight D.S.; Kellman P.; Ruberg F.L.; Gillmore J.D.; Moon J.C.; Hawkins P.N.; Fontana M.","Martinez-Naharro, Ana (55343433500); Kotecha, Tushar (38661453500); Norrington, Karl (56074685100); Boldrini, Michele (55258660000); Rezk, Tamer (55985701600); Quarta, Candida (56619484400); Treibel, Thomas A. (15754511800); Whelan, Carol J. (36647033100); Knight, Daniel S. (55589453200); Kellman, Peter (7004851504); Ruberg, Frederick L. (6505829458); Gillmore, Julian D. (7003539031); Moon, James C. (7403231345); Hawkins, Philip N. (35464959200); Fontana, Marianna (16306839900)","55343433500; 38661453500; 56074685100; 55258660000; 55985701600; 56619484400; 15754511800; 36647033100; 55589453200; 7004851504; 6505829458; 7003539031; 7403231345; 35464959200; 16306839900","Native T1 and Extracellular Volume in Transthyretin Amyloidosis","2019","JACC: Cardiovascular Imaging","12","5","","810","819","9","225","10.1016/j.jcmg.2018.02.006","https://www.scopus.com/inward/record.uri?eid=2-s2.0-85043534019&doi=10.1016%2fj.jcmg.2018.02.006&partnerID=40&md5=7c99d61d582a4eb593326da3a50824f9","Article","Final","All Open Access; Bronze Open Access; Green Open Access","Scopus","2-s2.0-85043534019"
"Bulluck H.; Hammond-Haley M.; Fontana M.; Knight D.S.; Sirker A.; Herrey A.S.; Manisty C.; Kellman P.; Moon J.C.; Hausenloy D.J.","Bulluck, Heerajnarain (53981151600); Hammond-Haley, Matthew (57188575219); Fontana, Marianna (16306839900); Knight, Daniel S. (55589453200); Sirker, Alex (24077375900); Herrey, Anna S. (26534328000); Manisty, Charlotte (6504025861); Kellman, Peter (7004851504); Moon, James C. (7403231345); Hausenloy, Derek J. (6602976997)","53981151600; 57188575219; 16306839900; 55589453200; 24077375900; 26534328000; 6504025861; 7004851504; 7403231345; 6602976997","Quantification of both the area-at-risk and acute myocardial infarct size in ST-segment elevation myocardial infarction using T1-mapping","2017","Journal of Cardiovascular Magnetic Resonance","19","1","57","","","","45","10.1186/s12968-017-0370-6","https://www.scopus.com/inward/record.uri?eid=2-s2.0-85026517157&doi=10.1186%2fs12968-017-0370-6&partnerID=40&md5=3ae50502a3dd5feef829a5f4578d0262","Article","Final","All Open Access; Gold Open Access; Green Open Access","Scopus","2-s2.0-85026517157"
"Bandera F.; Martone R.; Chacko L.; Ganesananthan S.; Gilbertson J.A.; Ponticos M.; Lane T.; Martinez-Naharro A.; Whelan C.; Quarta C.; Rowczenio D.; Patel R.; Razvi Y.; Lachmann H.; Wechelakar A.; Brown J.; Knight D.; Moon J.; Petrie A.; Cappelli F.; Guazzi M.; Potena L.; Rapezzi C.; Leone O.; Hawkins P.N.; Gillmore J.D.; Fontana M.","Bandera, Francesco (55325767500); Martone, Raffaele (57200571622); Chacko, Liza (57210256202); Ganesananthan, Sharmananthan (57220863491); Gilbertson, Janet A. (7005657127); Ponticos, Markella (6602769002); Lane, Thirusha (41861760800); Martinez-Naharro, Ana (55343433500); Whelan, Carol (36647033100); Quarta, Cristina (57347613400); Rowczenio, Dorota (14012189400); Patel, Rishi (57210156635); Razvi, Yousuf (57219044558); Lachmann, Helen (7004915734); Wechelakar, Ashutosh (57347924300); Brown, James (57212760167); Knight, Daniel (55589453200); Moon, James (57202314649); Petrie, Aviva (35974110300); Cappelli, Francesco (11541161800); Guazzi, Marco (7102760456); Potena, Luciano (6602877926); Rapezzi, Claudio (7005883289); Leone, Ornella (7004143746); Hawkins, Philip N. (35464959200); Gillmore, Julian D. (7003539031); Fontana, Marianna (16306839900)","55325767500; 57200571622; 57210256202; 57220863491; 7005657127; 6602769002; 41861760800; 55343433500; 36647033100; 57347613400; 14012189400; 57210156635; 57219044558; 7004915734; 57347924300; 57212760167; 55589453200; 57202314649; 35974110300; 11541161800; 7102760456; 6602877926; 7005883289; 7004143746; 35464959200; 7003539031; 16306839900","The Authors’ Reply","2021","JACC: Cardiovascular Imaging","14","11","","2268","2269","1","0","10.1016/j.jcmg.2021.09.025","https://www.scopus.com/inward/record.uri?eid=2-s2.0-85119515786&doi=10.1016%2fj.jcmg.2021.09.025&partnerID=40&md5=e1bfa130eaebc4267acb6c87ccbf1952","Letter","Final","","Scopus","2-s2.0-85119515786"
"Knight D.; Muthurangu V.","Knight, Daniel (55589453200); Muthurangu, Vivek (7801671480)","55589453200; 7801671480","CMR Assessment of Mitral Regurgitation","2021","Transcatheter Mitral Valve Therapies","","","","51","61","10","0","10.1002/9781119763741.ch5","https://www.scopus.com/inward/record.uri?eid=2-s2.0-85153808292&doi=10.1002%2f9781119763741.ch5&partnerID=40&md5=29cf885c31932f7f519337ec07f873b7","Book chapter","Final","","Scopus","2-s2.0-85153808292"
"Knight D.; Muthurangu V.","Knight, Daniel (55589453200); Muthurangu, Vivek (7801671480)","55589453200; 7801671480","Pulmonary hypertension","2023","Magnetic Resonance Imaging of Congenital Heart Disease","","","","137","146","9","0","10.1007/978-3-031-29235-4_8","https://www.scopus.com/inward/record.uri?eid=2-s2.0-85194018657&doi=10.1007%2f978-3-031-29235-4_8&partnerID=40&md5=de988517d818091c761064dcf8a36d18","Book chapter","Final","","Scopus","2-s2.0-85194018657"
"Chacko L.; Martone R.; Bandera F.; Lane T.; Martinez-Naharro A.; Boldrini M.; Rezk T.; Whelan C.; Quarta C.; Rowczenio D.; Gilbertson J.A.; Wongwarawipat T.; Lachmann H.; Wechalekar A.; Sachchithanantham S.; Mahmood S.; Marcucci R.; Knight D.; Hutt D.; Moon J.; Petrie A.; Cappelli F.; Guazzi M.; Hawkins P.N.; Gillmore J.D.; Fontana M.","Chacko, Liza (57210256202); Martone, Raffaele (57200571622); Bandera, Francesco (55325767500); Lane, Thirusha (41861760800); Martinez-Naharro, Ana (55343433500); Boldrini, Michele (55258660000); Rezk, Tamer (55985701600); Whelan, Carol (36647033100); Quarta, Cristina (56619484400); Rowczenio, Dorota (14012189400); Gilbertson, Janet A (7005657127); Wongwarawipat, Tanakal (57196056137); Lachmann, Helen (7004915734); Wechalekar, Ashutosh (6506002568); Sachchithanantham, Sajitha (55621355900); Mahmood, Shameem (50361564300); Marcucci, Rossella (57202554432); Knight, Daniel (55589453200); Hutt, David (55985822300); Moon, James (57202314649); Petrie, Aviva (35974110300); Cappelli, Francesco (11541161800); Guazzi, Marco (7102760456); Hawkins, Philip N (35464959200); Gillmore, Julian D (7003539031); Fontana, Marianna (16306839900)","57210256202; 57200571622; 55325767500; 41861760800; 55343433500; 55258660000; 55985701600; 36647033100; 56619484400; 14012189400; 7005657127; 57196056137; 7004915734; 6506002568; 55621355900; 50361564300; 57202554432; 55589453200; 55985822300; 57202314649; 35974110300; 11541161800; 7102760456; 35464959200; 7003539031; 16306839900","Echocardiographic phenotype and prognosis in transthyretin cardiac amyloidosis","2020","European Heart Journal","41","14","","1439","1447a","8","139","10.1093/eurheartj/ehz905","https://www.scopus.com/inward/record.uri?eid=2-s2.0-85080920287&doi=10.1093%2feurheartj%2fehz905&partnerID=40&md5=fb11282a9ea3cfe7c0c64dd620d7d275","Article","Final","All Open Access; Green Open Access","Scopus","2-s2.0-85080920287"
"Martinez-Naharro A.; Abdel-Gadir A.; Treibel T.A.; Zumbo G.; Knight D.S.; Rosmini S.; Lane T.; Mahmood S.; Sachchithanantham S.; Whelan C.J.; Lachmann H.J.; Wechalekar A.D.; Kellman P.; Gillmore J.D.; Moon J.C.; Hawkins P.N.; Fontana M.","Martinez-Naharro, Ana (55343433500); Abdel-Gadir, Amna (56528300800); Treibel, Thomas A. (15754511800); Zumbo, Giulia (57193211591); Knight, Daniel S. (55589453200); Rosmini, Stefania (35620856500); Lane, Thirusha (41861760800); Mahmood, Shameem (50361564300); Sachchithanantham, Sajitha (55621355900); Whelan, Carol J. (36647033100); Lachmann, Helen J. (7004915734); Wechalekar, Ashutosh D. (6506002568); Kellman, Peter (7004851504); Gillmore, Julian D. (7003539031); Moon, James C. (7403231345); Hawkins, Philip N. (35464959200); Fontana, Marianna (16306839900)","55343433500; 56528300800; 15754511800; 57193211591; 55589453200; 35620856500; 41861760800; 50361564300; 55621355900; 36647033100; 7004915734; 6506002568; 7004851504; 7003539031; 7403231345; 35464959200; 16306839900","CMR-Verified Regression of Cardiac AL Amyloid After Chemotherapy","2018","JACC: Cardiovascular Imaging","11","1","","152","154","2","103","10.1016/j.jcmg.2017.02.012","https://www.scopus.com/inward/record.uri?eid=2-s2.0-85017454304&doi=10.1016%2fj.jcmg.2017.02.012&partnerID=40&md5=7072f4acb20dd5dce4cc1d8681d1909b","Letter","Final","","Scopus","2-s2.0-85017454304"
"Martinez-Naharro A.; Treibel T.A.; Abdel-Gadir A.; Bulluck H.; Zumbo G.; Knight D.S.; Kotecha T.; Francis R.; Hutt D.F.; Rezk T.; Rosmini S.; Quarta C.C.; Whelan C.J.; Kellman P.; Gillmore J.D.; Moon J.C.; Hawkins P.N.; Fontana M.","Martinez-Naharro, Ana (55343433500); Treibel, Thomas A. (15754511800); Abdel-Gadir, Amna (56528300800); Bulluck, Heerajnarain (53981151600); Zumbo, Giulia (57193211591); Knight, Daniel S. (55589453200); Kotecha, Tushar (38661453500); Francis, Rohin (57194779300); Hutt, David F. (55985822300); Rezk, Tamer (55985701600); Rosmini, Stefania (35620856500); Quarta, Candida C. (56619484400); Whelan, Carol J. (36647033100); Kellman, Peter (7004851504); Gillmore, Julian D. (7003539031); Moon, James C. (7403231345); Hawkins, Philip N. (35464959200); Fontana, Marianna (16306839900)","55343433500; 15754511800; 56528300800; 53981151600; 57193211591; 55589453200; 38661453500; 57194779300; 55985822300; 55985701600; 35620856500; 56619484400; 36647033100; 7004851504; 7003539031; 7403231345; 35464959200; 16306839900","Magnetic Resonance in Transthyretin Cardiac Amyloidosis","2017","Journal of the American College of Cardiology","70","4","","466","477","11","351","10.1016/j.jacc.2017.05.053","https://www.scopus.com/inward/record.uri?eid=2-s2.0-85028607026&doi=10.1016%2fj.jacc.2017.05.053&partnerID=40&md5=b6d038eac58f77c3b21ba9c88d4bfdfd","Article","Final","All Open Access; Bronze Open Access; Green Open Access","Scopus","2-s2.0-85028607026"
"Patel R.K.; Bandera F.; Venneri L.; Knight D.; Porcari A.; Muthurangu V.; Guazzi M.; Hawkins P.N.; Gillmore J.D.; Fontana M.","Patel, Rishi K. (57210156635); Bandera, Francesco (55325767500); Venneri, Lucia (6506276972); Knight, Daniel (55589453200); Porcari, Aldostefano (57201271007); Muthurangu, Vivek (7801671480); Guazzi, Marco (7102760456); Hawkins, Philip N. (35464959200); Gillmore, Julian D. (7003539031); Fontana, Marianna (16306839900)","57210156635; 55325767500; 6506276972; 55589453200; 57201271007; 7801671480; 7102760456; 35464959200; 7003539031; 16306839900","Cardiopulmonary Exercise Testing With Exercise Echocardiography to Assess Treatment Response in Transthyretin Amyloid Cardiomyopathy","2025","JACC: Heart Failure","13","5","","857","859","2","0","10.1016/j.jchf.2025.01.020","https://www.scopus.com/inward/record.uri?eid=2-s2.0-105003311380&doi=10.1016%2fj.jchf.2025.01.020&partnerID=40&md5=7b29321c2cb046ebbc43277c1c012ed2","Letter","Final","","Scopus","2-s2.0-105003311380"
"Chacko L.; Karia N.; Venneri L.; Bandera F.; Passo B.D.; Buonamici L.; Lazari J.; Ioannou A.; Porcari A.; Patel R.; Razvi Y.; Brown J.; Knight D.; Martinez-Naharro A.; Whelan C.; Quarta C.C.; Manisty C.; Moon J.; Rowczenio D.; Gilbertson J.A.; Lachmann H.; Wechelakar A.; Petrie A.; Moody W.E.; Steeds R.P.; Potena L.; Riefolo M.; Leone O.; Rapezzi C.; Hawkins P.N.; Gillmore J.D.; Fontana M.","Chacko, Liza (57210256202); Karia, Nina (37122124800); Venneri, Lucia (6506276972); Bandera, Francesco (55325767500); Passo, Beatrice Dal (57819576800); Buonamici, Lodovico (57819576900); Lazari, Jonathan (57204354738); Ioannou, Adam (57188664278); Porcari, Aldostefano (57201271007); Patel, Rishi (57210156635); Razvi, Yousuf (57219044558); Brown, James (57212760167); Knight, Daniel (55589453200); Martinez-Naharro, Ana (55343433500); Whelan, Carol (36647033100); Quarta, Candida C. (56619484400); Manisty, Charlotte (6504025861); Moon, James (57202314649); Rowczenio, Dorota (14012189400); Gilbertson, Janet A. (7005657127); Lachmann, Helen (7004915734); Wechelakar, Ashutosh (57347924300); Petrie, Aviva (35974110300); Moody, William E. (36806699500); Steeds, Richard P. (57189931631); Potena, Luciano (6602877926); Riefolo, Mattia (57200551144); Leone, Ornella (7004143746); Rapezzi, Claudio (7005883289); Hawkins, Philip N. (35464959200); Gillmore, Julian D. (7003539031); Fontana, Marianna (16306839900)","57210256202; 37122124800; 6506276972; 55325767500; 57819576800; 57819576900; 57204354738; 57188664278; 57201271007; 57210156635; 57219044558; 57212760167; 55589453200; 55343433500; 36647033100; 56619484400; 6504025861; 57202314649; 14012189400; 7005657127; 7004915734; 57347924300; 35974110300; 36806699500; 57189931631; 6602877926; 57200551144; 7004143746; 7005883289; 35464959200; 7003539031; 16306839900","Progression of echocardiographic parameters and prognosis in transthyretin cardiac amyloidosis","2022","European Journal of Heart Failure","24","9","","1700","1712","12","56","10.1002/ejhf.2606","https://www.scopus.com/inward/record.uri?eid=2-s2.0-85134992951&doi=10.1002%2fejhf.2606&partnerID=40&md5=64dd3bea2c5e809695038ca2136f0556","Article","Final","All Open Access; Green Open Access","Scopus","2-s2.0-85134992951"
"Kotecha T.; Martinez-Naharro A.; Boldrini M.; Knight D.; Hawkins P.; Kalra S.; Patel D.; Coghlan G.; Moon J.; Plein S.; Lockie T.; Rakhit R.; Patel N.; Xue H.; Kellman P.; Fontana M.","Kotecha, Tushar (38661453500); Martinez-Naharro, Ana (55343433500); Boldrini, Michele (55258660000); Knight, Daniel (55589453200); Hawkins, Philip (35464959200); Kalra, Sundeep (46761159400); Patel, Deven (57212154606); Coghlan, Gerry (23666861000); Moon, James (57202314649); Plein, Sven (6701840061); Lockie, Tim (16230845400); Rakhit, Roby (6603035925); Patel, Niket (55618205500); Xue, Hui (52365249300); Kellman, Peter (7004851504); Fontana, Marianna (16306839900)","38661453500; 55343433500; 55258660000; 55589453200; 35464959200; 46761159400; 57212154606; 23666861000; 57202314649; 6701840061; 16230845400; 6603035925; 55618205500; 52365249300; 7004851504; 16306839900","Automated Pixel-Wise Quantitative Myocardial Perfusion Mapping by CMR to Detect Obstructive Coronary Artery Disease and Coronary Microvascular Dysfunction: Validation Against Invasive Coronary Physiology","2019","JACC: Cardiovascular Imaging","12","10","","1958","1969","11","191","10.1016/j.jcmg.2018.12.022","https://www.scopus.com/inward/record.uri?eid=2-s2.0-85066033563&doi=10.1016%2fj.jcmg.2018.12.022&partnerID=40&md5=dd0dff16b59db66eb5e355ccd80e0e08","Article","Final","All Open Access; Bronze Open Access; Green Open Access","Scopus","2-s2.0-85066033563"
"Francis R.; Kellman P.; Kotecha T.; Baggiano A.; Norrington K.; Martinez-Naharro A.; Nordin S.; Knight D.S.; Rakhit R.D.; Lockie T.; Hawkins P.N.; Moon J.C.; Hausenloy D.J.; Xue H.; Hansen M.S.; Fontana M.","Francis, Rohin (57194779300); Kellman, Peter (7004851504); Kotecha, Tushar (38661453500); Baggiano, Andrea (57210310775); Norrington, Karl (56074685100); Martinez-Naharro, Ana (55343433500); Nordin, Sabrina (57190741709); Knight, Daniel S. (55589453200); Rakhit, Roby D. (6603035925); Lockie, Tim (16230845400); Hawkins, Philip N. (35464959200); Moon, James C. (7403231345); Hausenloy, Derek J. (6602976997); Xue, Hui (52365249300); Hansen, Michael S. (35562748700); Fontana, Marianna (16306839900)","57194779300; 7004851504; 38661453500; 57210310775; 56074685100; 55343433500; 57190741709; 55589453200; 6603035925; 16230845400; 35464959200; 7403231345; 6602976997; 52365249300; 35562748700; 16306839900","Prospective comparison of novel dark blood late gadolinium enhancement with conventional bright blood imaging for the detection of scar","2017","Journal of Cardiovascular Magnetic Resonance","19","1","91","","","","37","10.1186/s12968-017-0407-x","https://www.scopus.com/inward/record.uri?eid=2-s2.0-85034732736&doi=10.1186%2fs12968-017-0407-x&partnerID=40&md5=2cd17a530e140c49c06e7a27abf5ab8d","Article","Final","All Open Access; Gold Open Access; Green Open Access","Scopus","2-s2.0-85034732736"
"Brown J.T.; Saigal A.; Karia N.; Patel R.K.; Razvi Y.; Constantinou N.; Steeden J.A.; Mandal S.; Kotecha T.; Fontana M.; Goldring J.; Muthurangu V.; Knight D.S.","Brown, James T. (57212760167); Saigal, Anita (39062053700); Karia, Nina (37122124800); Patel, Rishi K. (57210156635); Razvi, Yousuf (57219044558); Constantinou, Natalie (57675881400); Steeden, Jennifer A. (36605240600); Mandal, Swapna (53463635000); Kotecha, Tushar (38661453500); Fontana, Marianna (16306839900); Goldring, James (25027606200); Muthurangu, Vivek (7801671480); Knight, Daniel S. (55589453200)","57212760167; 39062053700; 37122124800; 57210156635; 57219044558; 57675881400; 36605240600; 53463635000; 38661453500; 16306839900; 25027606200; 7801671480; 55589453200","Ongoing Exercise Intolerance Following COVID-19: A Magnetic Resonance– Augmented Cardiopulmonary Exercise Test Study","2022","Journal of the American Heart Association","11","9","e024207","","","","20","10.1161/JAHA.121.024207","https://www.scopus.com/inward/record.uri?eid=2-s2.0-85129780771&doi=10.1161%2fJAHA.121.024207&partnerID=40&md5=e07b07ae6287d84e992a5a9f571962a7","Article","Final","All Open Access; Gold Open Access; Green Open Access","Scopus","2-s2.0-85129780771"
"Artico J.; Shiwani H.; Moon J.C.; Gorecka M.; McCann G.P.; Roditi G.; Morrow A.; Mangion K.; Lukaschuk E.; Shanmuganathan M.; Miller C.A.; Chiribiri A.; Prasad S.K.; Adam R.D.; Singh T.; Bucciarelli-Ducci C.; Dawson D.; Knight D.; Fontana M.; Manisty C.; Treibel T.A.; Levelt E.; Arnold R.; Macfarlane P.W.; Young R.; McConnachie A.; Neubauer S.; Piechnik S.K.; Davies R.H.; Ferreira V.M.; Dweck M.R.; Berry C.; Greenwood J.P.","Artico, Jessica (57188622189); Shiwani, Hunain (57189469874); Moon, James C. (57202314649); Gorecka, Miroslawa (56089941300); McCann, Gerry P. (7005783434); Roditi, Giles (6603546623); Morrow, Andrew (57205415428); Mangion, Kenneth (56422223500); Lukaschuk, Elena (57203083063); Shanmuganathan, Mayooran (57218479125); Miller, Christopher A. (57203424537); Chiribiri, Amedeo (22984044200); Prasad, Sanjay K. (7403003613); Adam, Robert D. (57210892559); Singh, Trisha (57215892717); Bucciarelli-Ducci, Chiara (18534251300); Dawson, Dana (7402379761); Knight, Daniel (55589453200); Fontana, Marianna (16306839900); Manisty, Charlotte (6504025861); Treibel, Thomas A. (15754511800); Levelt, Eylem (24476505200); Arnold, Ranjit (13005507700); Macfarlane, Peter W. (56689458300); Young, Robin (57737166800); McConnachie, Alex (6701526254); Neubauer, Stefan (55794522200); Piechnik, Stefan K. (7004664392); Davies, Rhodri H. (57198821565); Ferreira, Vanessa M. (35224811100); Dweck, Marc R. (12783691400); Berry, Colin (57203056149); Greenwood, John P. (58588572000)","57188622189; 57189469874; 57202314649; 56089941300; 7005783434; 6603546623; 57205415428; 56422223500; 57203083063; 57218479125; 57203424537; 22984044200; 7403003613; 57210892559; 57215892717; 18534251300; 7402379761; 55589453200; 16306839900; 6504025861; 15754511800; 24476505200; 13005507700; 56689458300; 57737166800; 6701526254; 55794522200; 7004664392; 57198821565; 35224811100; 12783691400; 57203056149; 58588572000","Myocardial Involvement after Hospitalization for COVID-19 Complicated by Troponin Elevation: A Prospective, Multicenter, Observational Study","2023","Circulation","147","5","","364","374","10","58","10.1161/CIRCULATIONAHA.122.060632","https://www.scopus.com/inward/record.uri?eid=2-s2.0-85147146799&doi=10.1161%2fCIRCULATIONAHA.122.060632&partnerID=40&md5=147728cc91f55ab3818dd71abb85959c","Article","Final","All Open Access; Green Open Access; Hybrid Gold Open Access","Scopus","2-s2.0-85147146799"
"Knight D.S.; Kotecha T.; Martinez-Naharro A.; Brown J.T.; Bertelli M.; Fontana M.; Muthurangu V.; Coghlan J.G.","Knight, Daniel S. (55589453200); Kotecha, Tushar (38661453500); Martinez-Naharro, Ana (55343433500); Brown, James T. (57212760167); Bertelli, Michele (59782360800); Fontana, Marianna (16306839900); Muthurangu, Vivek (7801671480); Coghlan, J. Gerry (35393553500)","55589453200; 38661453500; 55343433500; 57212760167; 59782360800; 16306839900; 7801671480; 35393553500","Cardiovascular magnetic resonance-guided right heart catheterization in a conventional CMR environment - Predictors of procedure success and duration in pulmonary artery hypertension","2019","Journal of Cardiovascular Magnetic Resonance","21","1","57","","","","34","10.1186/s12968-019-0569-9","https://www.scopus.com/inward/record.uri?eid=2-s2.0-85071896462&doi=10.1186%2fs12968-019-0569-9&partnerID=40&md5=1dc1772e143ee54bdea7966b03b91d36","Article","Final","All Open Access; Gold Open Access; Green Open Access","Scopus","2-s2.0-85071896462"
"Knight D.S.; Grasso A.E.; Quail M.A.; Muthurangu V.; Taylor A.M.; Toumpanakis C.; Caplin M.E.; Coghlan J.G.; Davar J.","Knight, Daniel S. (55589453200); Grasso, Agata E. (25723207100); Quail, Michael A. (35380885000); Muthurangu, Vivek (7801671480); Taylor, Andrew M. (57195810900); Toumpanakis, Christos (16033469000); Caplin, Martyn E. (55908628800); Coghlan, J. Gerry (35393553500); Davar, Joseph (6507903916)","55589453200; 25723207100; 35380885000; 7801671480; 57195810900; 16033469000; 55908628800; 35393553500; 6507903916","Accuracy and reproducibility of right ventricular quantification in patients with pressure and volume overload using single-beat three-dimensional echocardiography","2015","Journal of the American Society of Echocardiography","28","3","","363","374","11","55","10.1016/j.echo.2014.10.012","https://www.scopus.com/inward/record.uri?eid=2-s2.0-84933279032&doi=10.1016%2fj.echo.2014.10.012&partnerID=40&md5=4d6a6cbd5b7935cb7ac22ea678dde9f5","Article","Final","All Open Access; Green Open Access; Hybrid Gold Open Access","Scopus","2-s2.0-84933279032"
"Razvi Y.; Ioannou A.; Patel R.K.; Chacko L.; Karia N.; Riefolo M.; Porcari A.; Rauf M.U.; Starr N.; Ganesananthan S.; Blakeney I.; Kaza N.; Filisetti S.; Bolhuis R.E.; Rowczenio D.; Gilbertson J.; Hutt D.; Mahmood S.; Lachmann H.J.; Wechalekar A.D.; Kotecha T.; Knight D.S.; Coghlan J.G.; Petrie A.; Whelan C.J.; Venneri L.; Martinez-Naharro A.; Hawkins P.; Fontana M.; Gillmore J.D.","Razvi, Yousuf (57219044558); Ioannou, Adam (57188664278); Patel, Rishi K. (57210156635); Chacko, Liza (57210256202); Karia, Nina (37122124800); Riefolo, Mattia (57200551144); Porcari, Aldostefano (57201271007); Rauf, Muhammad Umaid (57985713000); Starr, Neasa (59883441800); Ganesananthan, Sashiananthan (6504139598); Blakeney, Iona (57216860730); Kaza, Nandita (57209368190); Filisetti, Stefano (58539537900); Bolhuis, Roos Eline (58539470600); Rowczenio, Dorota (14012189400); Gilbertson, Janet (7005657127); Hutt, David (55985822300); Mahmood, Shameem (50361564300); Lachmann, Helen J. (7004915734); Wechalekar, Ashutosh D. (6506002568); Kotecha, Tushar (38661453500); Knight, Daniel S. (55589453200); Coghlan, John G. (35393553500); Petrie, Aviva (35974110300); Whelan, Carol J. (36647033100); Venneri, Lucia (6506276972); Martinez-Naharro, Ana (55343433500); Hawkins, Phillip (35464959200); Fontana, Marianna (16306839900); Gillmore, Julian D. (7003539031)","57219044558; 57188664278; 57210156635; 57210256202; 37122124800; 57200551144; 57201271007; 57985713000; 59883441800; 6504139598; 57216860730; 57209368190; 58539537900; 58539470600; 14012189400; 7005657127; 55985822300; 50361564300; 7004915734; 6506002568; 38661453500; 55589453200; 35393553500; 35974110300; 36647033100; 6506276972; 55343433500; 35464959200; 16306839900; 7003539031","Deep phenotyping of p.(V142I)-associated variant transthyretin amyloid cardiomyopathy: Distinct from wild-type transthyretin amyloidosis?","2024","European Journal of Heart Failure","26","2","","383","393","10","15","10.1002/ejhf.3088","https://www.scopus.com/inward/record.uri?eid=2-s2.0-85183928583&doi=10.1002%2fejhf.3088&partnerID=40&md5=c657a9512b4e2e1c92dc6da9016e533d","Article","Final","","Scopus","2-s2.0-85183928583"
