"Authors","Author full names","Author(s) ID","Title","Year","Source title","Volume","Issue","Art. No.","Page start","Page end","Page count","Cited by","DOI","Link","Document Type","Publication Stage","Open Access","Source","EID"
"Ioannou A.; Patel R.K.; Razvi Y.; Porcari A.; Sinagra G.; Venneri L.; Bandera F.; Masi A.; Williams G.E.; O'Beara S.; Ganesananthan S.; Massa P.; Knight D.; Martinez-Naharro A.; Kotecha T.; Chacko L.; Brown J.; Rauf M.U.; Manisty C.; Moon J.; Lachmann H.; Wechelakar A.; Petrie A.; Whelan C.; Hawkins P.N.; Gillmore J.D.; Fontana M.","Ioannou, Adam (57188664278); Patel, Rishi K. (57210156635); Razvi, Yousuf (57219044558); Porcari, Aldostefano (57201271007); Sinagra, Gianfranco (7005062509); Venneri, Lucia (6506276972); Bandera, Francesco (55325767500); Masi, Ambra (57718446200); Williams, Georgina E. (57987061800); O'Beara, Sophie (57987073900); Ganesananthan, Sharmananthan (57220863491); Massa, Paolo (57225010842); Knight, Daniel (55589453200); Martinez-Naharro, Ana (55343433500); Kotecha, Tushar (38661453500); Chacko, Liza (57210256202); Brown, James (57212760167); Rauf, Muhammad U. (57985713000); Manisty, Charlotte (6504025861); Moon, James (7403231345); Lachmann, Helen (7004915734); Wechelakar, Ashutosh (57347924300); Petrie, Aviva (35974110300); Whelan, Carol (36647033100); Hawkins, Philip N. (35464959200); Gillmore, Julian D. (7003539031); Fontana, Marianna (16306839900)","57188664278; 57210156635; 57219044558; 57201271007; 7005062509; 6506276972; 55325767500; 57718446200; 57987061800; 57987073900; 57220863491; 57225010842; 55589453200; 55343433500; 38661453500; 57210256202; 57212760167; 57985713000; 6504025861; 7403231345; 7004915734; 57347924300; 35974110300; 36647033100; 35464959200; 7003539031; 16306839900","Impact of Earlier Diagnosis in Cardiac ATTR Amyloidosis over the Course of 20 Years","2022","Circulation","146","22","","1657","1670","13","142","10.1161/CIRCULATIONAHA.122.060852","https://www.scopus.com/inward/record.uri?eid=2-s2.0-85142940860&doi=10.1161%2fCIRCULATIONAHA.122.060852&partnerID=40&md5=48df95e63904cfb15ba8ed3e12363368","Article","Final","All Open Access; Green Open Access; Hybrid Gold Open Access","Scopus","2-s2.0-85142940860"
"Knight D.S.; Kotecha T.; Razvi Y.; Chacko L.; Brown J.T.; Jeetley P.S.; Goldring J.; Jacobs M.; Lamb L.E.; Negus R.; Wolff A.; Moon J.C.; Xue H.; Kellman P.; Patel N.; Fontana M.","Knight, Daniel S. (55589453200); Kotecha, Tushar (38661453500); Razvi, Yousuf (57219044558); Chacko, Liza (57210256202); Brown, James T. (57212760167); Jeetley, Paramjit S. (8434302300); Goldring, James (25027606200); Jacobs, Michael (36848322200); Lamb, Lucy E. (18536060000); Negus, Rupert (6603024058); Wolff, Anthony (7102453899); Moon, James C. (57202314649); Xue, Hui (52365249300); Kellman, Peter (7004851504); Patel, Niket (55618205500); Fontana, Marianna (16306839900)","55589453200; 38661453500; 57219044558; 57210256202; 57212760167; 8434302300; 25027606200; 36848322200; 18536060000; 6603024058; 7102453899; 57202314649; 52365249300; 7004851504; 55618205500; 16306839900","COVID-19: Myocardial Injury in Survivors","2020","Circulation","142","11","","1120","1122","2","130","10.1161/CIRCULATIONAHA.120.049252","https://www.scopus.com/inward/record.uri?eid=2-s2.0-85089726120&doi=10.1161%2fCIRCULATIONAHA.120.049252&partnerID=40&md5=b4194a98632a04f51f95ee3df47305e5","Article","Final","All Open Access; Bronze Open Access; Green Open Access","Scopus","2-s2.0-85089726120"
"Ioannou A.; Massa P.; Patel R.K.; Razvi Y.; Porcari A.; Rauf M.U.; Jiang A.; Cabras G.; Filisetti S.; Bolhuis R.E.; Bandera F.; Venneri L.; Martinez-Naharro A.; Law S.; Kotecha T.; Virsinskaite R.; Knight D.S.; Emdin M.; Petrie A.; Lachmann H.; Wechelakar A.; Petrie M.; Hughes A.; Freemantle N.; Hawkins P.N.; Whelan C.; McMurray J.J.V.; Gillmore J.D.; Fontana M.","Ioannou, Adam (57188664278); Massa, Paolo (57225010842); Patel, Rishi K. (57210156635); Razvi, Yousuf (57219044558); Porcari, Aldostefano (57201271007); Rauf, Muhammad U. (57985713000); Jiang, Anita (58539423200); Cabras, Giacomo (58539493300); Filisetti, Stefano (58539537900); Bolhuis, Roos E. (58539470600); Bandera, Francesco (55325767500); Venneri, Lucia (6506276972); Martinez-Naharro, Ana (55343433500); Law, Steven (57193713823); Kotecha, Tushar (38661453500); Virsinskaite, Ruta (58539561200); Knight, Daniel S. (55589453200); Emdin, Michele (7005694410); Petrie, Aviva (35974110300); Lachmann, Helen (7004915734); Wechelakar, Ashutosh (57347924300); Petrie, Mark (57222705876); Hughes, Alun (57207789660); Freemantle, Nick (7006066134); Hawkins, Philip N. (35464959200); Whelan, Carol (36647033100); McMurray, John J.V. (58023550400); Gillmore, Julian D. (7003539031); Fontana, Marianna (16306839900)","57188664278; 57225010842; 57210156635; 57219044558; 57201271007; 57985713000; 58539423200; 58539493300; 58539537900; 58539470600; 55325767500; 6506276972; 55343433500; 57193713823; 38661453500; 58539561200; 55589453200; 7005694410; 35974110300; 7004915734; 57347924300; 57222705876; 57207789660; 7006066134; 35464959200; 36647033100; 58023550400; 7003539031; 16306839900","Conventional heart failure therapy in cardiac ATTR amyloidosis","2023","European Heart Journal","44","31","","2893","2907","14","74","10.1093/eurheartj/ehad347","https://www.scopus.com/inward/record.uri?eid=2-s2.0-85168221471&doi=10.1093%2feurheartj%2fehad347&partnerID=40&md5=9f9c0a00bbe9c6916bcabf91cefe567d","Article","Final","All Open Access; Green Open Access; Hybrid Gold Open Access","Scopus","2-s2.0-85168221471"
"Quail M.A.; Steeden J.A.; Knight D.; Segers P.; Taylor A.M.; Muthurangu V.","Quail, Michael A. (35380885000); Steeden, Jennifer A. (36605240600); Knight, Daniel (55589453200); Segers, Patrick (7005378428); Taylor, Andrew M. (57195810900); Muthurangu, Vivek (7801671480)","35380885000; 36605240600; 55589453200; 7005378428; 57195810900; 7801671480","Development and validation of a novel method to derive central aortic systolic pressure from the MR aortic distension curve","2014","Journal of Magnetic Resonance Imaging","40","5","","1064","1070","6","26","10.1002/jmri.24471","https://www.scopus.com/inward/record.uri?eid=2-s2.0-84913608737&doi=10.1002%2fjmri.24471&partnerID=40&md5=c6191ae5adbbc11eb5204386bea68619","Article","Final","All Open Access; Bronze Open Access","Scopus","2-s2.0-84913608737"
"Knight D.S.; Zumbo G.; Barcella W.; Steeden J.A.; Muthurangu V.; Martinez-Naharro A.; Treibel T.A.; Abdel-Gadir A.; Bulluck H.; Kotecha T.; Francis R.; Rezk T.; Quarta C.C.; Whelan C.J.; Lachmann H.J.; Wechalekar A.D.; Gillmore J.D.; Moon J.C.; Hawkins P.N.; Fontana M.","Knight, Daniel S. (55589453200); Zumbo, Giulia (57193211591); Barcella, William (56768040900); Steeden, Jennifer A. (36605240600); Muthurangu, Vivek (7801671480); Martinez-Naharro, Ana (55343433500); Treibel, Thomas A. (15754511800); Abdel-Gadir, Amna (56528300800); Bulluck, Heerajnarain (53981151600); Kotecha, Tushar (38661453500); Francis, Rohin (57194779300); Rezk, Tamer (55985701600); Quarta, Candida C. (56619484400); Whelan, Carol J. (36647033100); Lachmann, Helen J. (7004915734); Wechalekar, Ashutosh D. (6506002568); Gillmore, Julian D. (7003539031); Moon, James C. (7403231345); Hawkins, Philip N. (35464959200); Fontana, Marianna (16306839900)","55589453200; 57193211591; 56768040900; 36605240600; 7801671480; 55343433500; 15754511800; 56528300800; 53981151600; 38661453500; 57194779300; 55985701600; 56619484400; 36647033100; 7004915734; 6506002568; 7003539031; 7403231345; 35464959200; 16306839900","Cardiac Structural and Functional Consequences of Amyloid Deposition by Cardiac Magnetic Resonance and Echocardiography and Their Prognostic Roles","2019","JACC: Cardiovascular Imaging","12","5","","823","833","10","138","10.1016/j.jcmg.2018.02.016","https://www.scopus.com/inward/record.uri?eid=2-s2.0-85045306445&doi=10.1016%2fj.jcmg.2018.02.016&partnerID=40&md5=3621ca666fddf92bb53f446160b49793","Article","Final","All Open Access; Bronze Open Access; Green Open Access","Scopus","2-s2.0-85045306445"
"Knight D.S.; Virsinskaite R.; Karia N.; Cole A.R.; Maclean R.H.; Brown J.T.; Patel R.K.; Razvi Y.; Venneri L.; Kotecha T.; Martinez-Naharro A.; Kellman P.; Scott-Russell A.M.; Schreiber B.E.; Ong V.H.; Denton C.P.; Fontana M.; Coghlan J.G.; Muthurangu V.","Knight, Daniel S. (55589453200); Virsinskaite, Ruta (58539561200); Karia, Nina (37122124800); Cole, Alice R. (57235401900); Maclean, Rory H. (57448509700); Brown, James T. (57212760167); Patel, Rishi K. (57210156635); Razvi, Yousuf (57219044558); Venneri, Lucia (6506276972); Kotecha, Tushar (38661453500); Martinez-Naharro, Ana (55343433500); Kellman, Peter (7004851504); Scott-Russell, Ann M. (24400040100); Schreiber, Benjamin E. (36106322600); Ong, Voon H. (8398311200); Denton, Christopher P. (7006031021); Fontana, Marianna (16306839900); Coghlan, J. Gerry (35393553500); Muthurangu, Vivek (7801671480)","55589453200; 58539561200; 37122124800; 57235401900; 57448509700; 57212760167; 57210156635; 57219044558; 6506276972; 38661453500; 55343433500; 7004851504; 24400040100; 36106322600; 8398311200; 7006031021; 16306839900; 35393553500; 7801671480","Native myocardial T1 and right ventricular size by CMR predict outcome in systemic sclerosis-associated pulmonary hypertension","2024","Rheumatology (United Kingdom)","63","10","","2678","2683","5","3","10.1093/rheumatology/keae141","https://www.scopus.com/inward/record.uri?eid=2-s2.0-85205526125&doi=10.1093%2frheumatology%2fkeae141&partnerID=40&md5=3046fc225a6e90a7cf5dd41928b311d2","Article","Final","All Open Access; Green Open Access; Hybrid Gold Open Access","Scopus","2-s2.0-85205526125"
"Kowalik G.T.; Knight D.S.; Steeden J.A.; Tann O.; Odille F.; Atkinson D.; Taylor A.; Muthurangu V.","Kowalik, Grzegorz T (6602362169); Knight, Daniel S (55589453200); Steeden, Jennifer A (36605240600); Tann, Oliver (24339325500); Odille, Freddy (24463413800); Atkinson, David (57216116485); Taylor, Andrew (57195810900); Muthurangu, Vivek (7801671480)","6602362169; 55589453200; 36605240600; 24339325500; 24463413800; 57216116485; 57195810900; 7801671480","Assessment of cardiac time intervals using high temporal resolution real-time spiral phase contrast with UNFOLD-SENSE","2014","Journal of Cardiovascular Magnetic Resonance","16","","W15","","","","0","10.1186/1532-429X-16-S1-W15","https://www.scopus.com/inward/record.uri?eid=2-s2.0-85181245183&doi=10.1186%2f1532-429X-16-S1-W15&partnerID=40&md5=4b088e00d73820675523637af40bf2e4","Article","Final","All Open Access; Gold Open Access; Green Open Access","Scopus","2-s2.0-85181245183"
"Jaubert O.; Montalt-Tordera J.; Knight D.; Arridge S.; Steeden J.; Muthurangu V.","Jaubert, Olivier (48461323600); Montalt-Tordera, Javier (57204789341); Knight, Daniel (55589453200); Arridge, Simon (7005759823); Steeden, Jennifer (36605240600); Muthurangu, Vivek (7801671480)","48461323600; 57204789341; 55589453200; 7005759823; 36605240600; 7801671480","HyperSLICE: HyperBand optimized spiral for low-latency interactive cardiac examination","2024","Magnetic Resonance in Medicine","91","1","","266","279","13","5","10.1002/mrm.29855","https://www.scopus.com/inward/record.uri?eid=2-s2.0-85173551883&doi=10.1002%2fmrm.29855&partnerID=40&md5=c551b1f0939567127312a767946c45c6","Article","Final","All Open Access; Green Open Access; Hybrid Gold Open Access","Scopus","2-s2.0-85173551883"
"Martinez-Naharro A.; Patel R.; Kotecha T.; Karia N.; Ioannou A.; Petrie A.; Chacko L.A.; Razvi Y.; Ravichandran S.; Brown J.; Law S.; Quarta C.; Mahmood S.; Wisniowski B.; Pica S.; Sachchithanantham S.; Lachmann H.J.; Moon J.C.; Knight D.S.; Whelan C.; Venneri L.; Xue H.; Kellman P.; Gillmore J.D.; Hawkins P.N.; Wechalekar A.D.; Fontana M.","Martinez-Naharro, Ana (55343433500); Patel, Rishi (57210156635); Kotecha, Tushar (38661453500); Karia, Nina (37122124800); Ioannou, Adam (57188664278); Petrie, Aviva (35974110300); Chacko, Liza A (57210256202); Razvi, Yousuf (57219044558); Ravichandran, Sriram (57216583258); Brown, James (57212760167); Law, Steven (57193713823); Quarta, Cristina (56619484400); Mahmood, Shameem (50361564300); Wisniowski, Brendan (43462252700); Pica, Silvia (55901552400); Sachchithanantham, Sajitha (55621355900); Lachmann, Helen J (7004915734); Moon, James C (57202314649); Knight, Daniel S (55589453200); Whelan, Carol (36647033100); Venneri, Lucia (6506276972); Xue, Hui (52365249300); Kellman, Peter (7004851504); Gillmore, Julian D (7003539031); Hawkins, Philip N (35464959200); Wechalekar, Ashutosh D (6506002568); Fontana, Marianna (16306839900)","55343433500; 57210156635; 38661453500; 37122124800; 57188664278; 35974110300; 57210256202; 57219044558; 57216583258; 57212760167; 57193713823; 56619484400; 50361564300; 43462252700; 55901552400; 55621355900; 7004915734; 57202314649; 55589453200; 36647033100; 6506276972; 52365249300; 7004851504; 7003539031; 35464959200; 6506002568; 16306839900","Cardiovascular magnetic resonance in light-chain amyloidosis to guide treatment","2022","European Heart Journal","43","45","","4722","4735","13","81","10.1093/eurheartj/ehac363","https://www.scopus.com/inward/record.uri?eid=2-s2.0-85143180955&doi=10.1093%2feurheartj%2fehac363&partnerID=40&md5=73e4aeccf6ace660376359c4ae406933","Article","Final","All Open Access; Green Open Access; Hybrid Gold Open Access","Scopus","2-s2.0-85143180955"
"Kotecha T.; Martinez-Naharro A.; Treibel T.A.; Francis R.; Nordin S.; Abdel-Gadir A.; Knight D.S.; Zumbo G.; Rosmini S.; Maestrini V.; Bulluck H.; Rakhit R.D.; Wechalekar A.D.; Gilbertson J.; Sheppard M.N.; Kellman P.; Gillmore J.D.; Moon J.C.; Hawkins P.N.; Fontana M.","Kotecha, Tushar (38661453500); Martinez-Naharro, Ana (55343433500); Treibel, Thomas A. (15754511800); Francis, Rohin (57194779300); Nordin, Sabrina (57190741709); Abdel-Gadir, Amna (56528300800); Knight, Daniel S. (55589453200); Zumbo, Giulia (57193211591); Rosmini, Stefania (35620856500); Maestrini, Viviana (55355501300); Bulluck, Heerajnarain (53981151600); Rakhit, Roby D. (6603035925); Wechalekar, Ashutosh D. (6506002568); Gilbertson, Janet (7005657127); Sheppard, Mary N. (7202508828); Kellman, Peter (7004851504); Gillmore, Julian D. (7003539031); Moon, James C. (57202314649); Hawkins, Philip N. (35464959200); Fontana, Marianna (16306839900)","38661453500; 55343433500; 15754511800; 57194779300; 57190741709; 56528300800; 55589453200; 57193211591; 35620856500; 55355501300; 53981151600; 6603035925; 6506002568; 7005657127; 7202508828; 7004851504; 7003539031; 57202314649; 35464959200; 16306839900","Myocardial Edema and Prognosis in Amyloidosis","2018","Journal of the American College of Cardiology","71","25","","2919","2931","12","174","10.1016/j.jacc.2018.03.536","https://www.scopus.com/inward/record.uri?eid=2-s2.0-85048292984&doi=10.1016%2fj.jacc.2018.03.536&partnerID=40&md5=615ea9d978b13cae178fe7a8330fa5fa","Article","Final","All Open Access; Bronze Open Access; Green Open Access","Scopus","2-s2.0-85048292984"
"Slegg O.G.; Willis J.A.; Wilkinson F.; Sparey J.; Wild C.B.; Rossdale J.; Ross R.M.; Pauling J.D.; Carson K.; Kandan S.R.; Oxborough D.; Knight D.; Peacock O.J.; Suntharalingam J.; Coghlan J.G.; Augustine D.X.","Slegg, Oliver Graham (57854640800); Willis, James Alexander (57194873095); Wilkinson, Fiona (8707402200); Sparey, Joseph (57854088200); Wild, Christopher Basil (57854226900); Rossdale, Jennifer (57200394698); Ross, Robert Mackenzie (7403242057); Pauling, John D. (24759261700); Carson, Kevin (55825562500); Kandan, Sri Raveen (56005093800); Oxborough, David (9634154900); Knight, Daniel (55589453200); Peacock, Oliver James (56556604000); Suntharalingam, Jay (16837744600); Coghlan, John Gerard (35393553500); Augustine, Daniel Xavier (57196650846)","57854640800; 57194873095; 8707402200; 57854088200; 57854226900; 57200394698; 7403242057; 24759261700; 55825562500; 56005093800; 9634154900; 55589453200; 56556604000; 16837744600; 35393553500; 57196650846","IMproving PULmonary hypertension Screening by Echocardiography: IMPULSE","2022","Echo Research and Practice","9","1","9","","","","7","10.1186/s44156-022-00010-9","https://www.scopus.com/inward/record.uri?eid=2-s2.0-85147581601&doi=10.1186%2fs44156-022-00010-9&partnerID=40&md5=964775c27d73758b5c28772b25ecab9d","Article","Final","All Open Access; Gold Open Access; Green Open Access","Scopus","2-s2.0-85147581601"
"Netti L.; Ioannou A.; Martinez-Naharro A.; Razvi Y.; Porcari A.; Venneri L.; Maestrini V.; Knight D.; Virsinskaite R.; Rauf M.U.; Kotecha T.; Patel R.K.; Wechelakar A.; Lachmann H.; Kellman P.; Manisty C.; Moon J.; Hawkins P.N.; Gillmore J.D.; Fontana M.","Netti, Lucrezia (57201267516); Ioannou, Adam (57188664278); Martinez-Naharro, Ana (55343433500); Razvi, Yousuf (57219044558); Porcari, Aldostefano (57201271007); Venneri, Lucia (6506276972); Maestrini, Viviana (55355501300); Knight, Dan (55589453200); Virsinskaite, Ruta (58539561200); Rauf, Muhammad U. (57985713000); Kotecha, Tushar (38661453500); Patel, Rishi K. (57210156635); Wechelakar, Ashutosh (57347924300); Lachmann, Helen (7004915734); Kellman, Peter (7004851504); Manisty, Charlotte (6504025861); Moon, James (57202314649); Hawkins, Philip N. (35464959200); Gillmore, Julian D. (7003539031); Fontana, Marianna (16306839900)","57201267516; 57188664278; 55343433500; 57219044558; 57201271007; 6506276972; 55355501300; 55589453200; 58539561200; 57985713000; 38661453500; 57210156635; 57347924300; 7004915734; 7004851504; 6504025861; 57202314649; 35464959200; 7003539031; 16306839900","Microvascular obstruction in cardiac amyloidosis","2024","European Journal of Heart Failure","","","","","","","2","10.1002/ejhf.3481","https://www.scopus.com/inward/record.uri?eid=2-s2.0-85206825425&doi=10.1002%2fejhf.3481&partnerID=40&md5=5b8c9ec5a85b493f8ccf339da955f278","Article","Article in press","All Open Access; Hybrid Gold Open Access","Scopus","2-s2.0-85206825425"
"Aimo A.; Chubuchny V.; Vergaro G.; Barison A.; Nicol M.; Cohen-Solal A.; Castiglione V.; Spini V.; Giannoni A.; Petersen C.; Taddei C.; Pasanisi E.; Chacko L.; Martone R.; Knight D.; Brown J.; Martinez-Naharro A.; Passino C.; Fontana M.; Emdin M.","Aimo, Alberto (56112889900); Chubuchny, Vladyslav (6506642215); Vergaro, Giuseppe (23111620200); Barison, Andrea (24597524200); Nicol, Martin (57016272200); Cohen-Solal, Alain (57189610711); Castiglione, Vincenzo (57200260361); Spini, Valentina (22987060400); Giannoni, Alberto (24490709200); Petersen, Christina (13613752200); Taddei, Claudia (57159282800); Pasanisi, Emilio (35616230200); Chacko, Liza (57210256202); Martone, Raffaele (57200571622); Knight, Dan (55589453200); Brown, James (57212760167); Martinez-Naharro, Ana (55343433500); Passino, Claudio (56868372700); Fontana, Marianna (16306839900); Emdin, Michele (7005694410)","56112889900; 6506642215; 23111620200; 24597524200; 57016272200; 57189610711; 57200260361; 22987060400; 24490709200; 13613752200; 57159282800; 35616230200; 57210256202; 57200571622; 55589453200; 57212760167; 55343433500; 56868372700; 16306839900; 7005694410","A simple echocardiographic score to rule out cardiac amyloidosis","2021","European Journal of Clinical Investigation","51","5","e13449","","","","36","10.1111/eci.13449","https://www.scopus.com/inward/record.uri?eid=2-s2.0-85096676248&doi=10.1111%2feci.13449&partnerID=40&md5=354575f568125bf3f6436a17218593e3","Article","Final","All Open Access; Green Open Access","Scopus","2-s2.0-85096676248"
"Ioannou A.; Nitsche C.; Porcari A.; Patel R.K.; Razvi Y.; Rauf M.U.; Martinez-Naharro A.; Venneri L.; Accietto A.; Netti L.; Bandera F.; Virsinskaite R.; Kotecha T.; Knight D.; Petrie A.; Whelan C.; Wechalekar A.; Lachmann H.; Hawkins P.N.; Gillmore J.D.; Fontana M.","Ioannou, Adam (57188664278); Nitsche, Christian (57205556434); Porcari, Aldostefano (57201271007); Patel, Rishi K. (57210156635); Razvi, Yousuf (57219044558); Rauf, Muhammad U. (57985713000); Martinez-Naharro, Ana (55343433500); Venneri, Lucia (6506276972); Accietto, Antonella (57864468500); Netti, Lucrezia (57201267516); Bandera, Francesco (55325767500); Virsinskaite, Ruta (58539561200); Kotecha, Tushar (38661453500); Knight, Dan (55589453200); Petrie, Aviva (35974110300); Whelan, Carol (36647033100); Wechalekar, Ashutosh (6506002568); Lachmann, Helen (7004915734); Hawkins, Philip N. (35464959200); Gillmore, Julian D. (7003539031); Fontana, Marianna (16306839900)","57188664278; 57205556434; 57201271007; 57210156635; 57219044558; 57985713000; 55343433500; 6506276972; 57864468500; 57201267516; 55325767500; 58539561200; 38661453500; 55589453200; 35974110300; 36647033100; 6506002568; 7004915734; 35464959200; 7003539031; 16306839900","Multiorgan Dysfunction and Associated Prognosis in Transthyretin Cardiac Amyloidosis","2024","Journal of the American Heart Association","13","4","e033094","","","","13","10.1161/JAHA.123.033094","https://www.scopus.com/inward/record.uri?eid=2-s2.0-85185614625&doi=10.1161%2fJAHA.123.033094&partnerID=40&md5=1d567d7267127676aa6c4dee73139855","Article","Final","All Open Access; Gold Open Access; Green Open Access","Scopus","2-s2.0-85185614625"
"Jaubert O.; Montalt-Tordera J.; Knight D.; Coghlan G.J.; Arridge S.; Steeden J.A.; Muthurangu V.","Jaubert, Olivier (48461323600); Montalt-Tordera, Javier (57204789341); Knight, Dan (55589453200); Coghlan, Gerry J. (23666861000); Arridge, Simon (7005759823); Steeden, Jennifer A. (36605240600); Muthurangu, Vivek (7801671480)","48461323600; 57204789341; 55589453200; 23666861000; 7005759823; 36605240600; 7801671480","Real-time deep artifact suppression using recurrent U-Nets for low-latency cardiac MRI","2021","Magnetic Resonance in Medicine","86","4","","1904","1916","12","17","10.1002/mrm.28834","https://www.scopus.com/inward/record.uri?eid=2-s2.0-85106321349&doi=10.1002%2fmrm.28834&partnerID=40&md5=207788f1fc016d3c4e72c98e8fbb86a0","Article","Final","All Open Access; Green Open Access; Hybrid Gold Open Access","Scopus","2-s2.0-85106321349"
"Ioannou A.; Patel R.K.; Martinez-Naharro A.; Razvi Y.; Porcari A.; Hutt D.F.; Bandera F.; Kotecha T.; Venneri L.; Chacko L.; Massa P.; Hanger M.; Knight D.; Manisty C.; Moon J.; Quarta C.; Lachmann H.; Whelan C.; Kellman P.; Hawkins P.N.; Gillmore J.D.; Wechelakar A.; Fontana M.","Ioannou, Adam (57188664278); Patel, Rishi K. (57210156635); Martinez-Naharro, Ana (55343433500); Razvi, Yousuf (57219044558); Porcari, Aldostefano (57201271007); Hutt, David F. (55985822300); Bandera, Francesco (55325767500); Kotecha, Tushar (38661453500); Venneri, Lucia (6506276972); Chacko, Liza (57210256202); Massa, Paolo (57225010842); Hanger, Melissa (57793314200); Knight, Daniel (55589453200); Manisty, Charlotte (6504025861); Moon, James (57202314649); Quarta, Cristina (56619484400); Lachmann, Helen (7004915734); Whelan, Carol (36647033100); Kellman, Peter (7004851504); Hawkins, Philip N. (35464959200); Gillmore, Julian D. (7003539031); Wechelakar, Ashutosh (57347924300); Fontana, Marianna (16306839900)","57188664278; 57210156635; 55343433500; 57219044558; 57201271007; 55985822300; 55325767500; 38661453500; 6506276972; 57210256202; 57225010842; 57793314200; 55589453200; 6504025861; 57202314649; 56619484400; 7004915734; 36647033100; 7004851504; 35464959200; 7003539031; 57347924300; 16306839900","Tracking Multiorgan Treatment Response in Systemic AL-Amyloidosis With Cardiac Magnetic Resonance Derived Extracellular Volume Mapping","2023","JACC: Cardiovascular Imaging","16","8","","1038","1052","14","22","10.1016/j.jcmg.2023.02.019","https://www.scopus.com/inward/record.uri?eid=2-s2.0-85163861785&doi=10.1016%2fj.jcmg.2023.02.019&partnerID=40&md5=7135cd9350c770ee99c11393a5136b25","Article","Final","All Open Access; Green Open Access; Hybrid Gold Open Access","Scopus","2-s2.0-85163861785"
"Jaubert O.; Montalt-Tordera J.; Brown J.; Knight D.; Arridge S.; Steeden J.; Muthurangu V.","Jaubert, Olivier (48461323600); Montalt-Tordera, Javier (57204789341); Brown, James (57212760167); Knight, Daniel (55589453200); Arridge, Simon (7005759823); Steeden, Jennifer (36605240600); Muthurangu, Vivek (7801671480)","48461323600; 57204789341; 57212760167; 55589453200; 7005759823; 36605240600; 7801671480","FReSCO: Flow Reconstruction and Segmentation for low-latency Cardiac Output monitoring using deep artifact suppression and segmentation","2022","Magnetic Resonance in Medicine","88","5","","2179","2189","10","4","10.1002/mrm.29374","https://www.scopus.com/inward/record.uri?eid=2-s2.0-85133371292&doi=10.1002%2fmrm.29374&partnerID=40&md5=d720817d1d94caa62a13453578bb3f80","Article","Final","All Open Access; Green Open Access","Scopus","2-s2.0-85133371292"
