Authors,Author(s) ID,Title,Year,Source title,Volume,Issue,Art. No.,Page start,Page end,Page count,Cited by,DOI,Link,Affiliations,Authors with affiliations,Abstract,Author Keywords,Index Keywords,Correspondence Address,Editors,Publisher,ISSN,ISBN,CODEN,PubMed ID,Language of Original Document,Abbreviated Source Title,Document Type,Publication Stage,Open Access,Source,EID
"Fogel M.A., Anwar S., Broberg C., Browne L., Chung T., Johnson T., Muthurangu V., Taylor M., Valsangiacomo-Buechel E., Wilhelm C.","7102455134;57748760900;6602638135;23491352300;7401571182;34975456500;7801671480;35396633800;10044074500;56956505100;","Society for Cardiovascular Magnetic Resonance/European Society of Cardiovascular Imaging/American Society of Echocardiography/Society for Pediatric Radiology/North American Society for Cardiovascular Imaging Guidelines for the use of cardiovascular magnetic resonance in pediatric congenital and acquired heart disease: Endorsed by The American Heart Association",2022,"Journal of Cardiovascular Magnetic Resonance","24","1","37","","",,,"10.1186/s12968-022-00843-7","https://www.scopus.com/inward/record.uri?eid=2-s2.0-85132162210&doi=10.1186%2fs12968-022-00843-7&partnerID=40&md5=d8476e0160a49b587a98b5ec2df9eb9c","Departments of Pediatrics (Cardiology) and Radiology, The Perelman School of Medicine, University of Pennsylvania, Philadelphia, PA, United States; Division of Cardiology, Department of Pediatrics, The Children’s Hospital of Philadelphia, Philadelphia, PA, United States; Department of Pediatrics (Cardiology) and Radiology, The University of California-San Francisco School of Medicine, San Francisco, United States; Division of Cardiovascular Medicine, Oregon Health and Sciences University, Portland, United States; Department of Radiology, University of Colorado, Denver, United States; Department of Radiology and Biomedical Imaging, The University of California-San Francisco School of Medicine, San Francisco, United States; Department of Pediatrics (Cardiology), Indiana University School of Medicine, Indianapolis, United States; Department of Pediatrics (Cardiology), University College London, London, United Kingdom; Department of Pediatrics (Cardiology), University of Cincinnati School of Medicine, Cincinnati, United States; Department of Diagnostic Imaging, University of Zurich, Zurich, Switzerland; Department of Pediatrics (Cardiology), University Hospitals-Cleveland, Cleaveland, United States","Fogel, M.A., Departments of Pediatrics (Cardiology) and Radiology, The Perelman School of Medicine, University of Pennsylvania, Philadelphia, PA, United States, Division of Cardiology, Department of Pediatrics, The Children’s Hospital of Philadelphia, Philadelphia, PA, United States; Anwar, S., Department of Pediatrics (Cardiology) and Radiology, The University of California-San Francisco School of Medicine, San Francisco, United States; Broberg, C., Division of Cardiovascular Medicine, Oregon Health and Sciences University, Portland, United States; Browne, L., Department of Radiology, University of Colorado, Denver, United States; Chung, T., Department of Radiology and Biomedical Imaging, The University of California-San Francisco School of Medicine, San Francisco, United States; Johnson, T., Department of Pediatrics (Cardiology), Indiana University School of Medicine, Indianapolis, United States; Muthurangu, V., Department of Pediatrics (Cardiology), University College London, London, United Kingdom; Taylor, M., Department of Pediatrics (Cardiology), University of Cincinnati School of Medicine, Cincinnati, United States; Valsangiacomo-Buechel, E., Department of Diagnostic Imaging, University of Zurich, Zurich, Switzerland; Wilhelm, C., Department of Pediatrics (Cardiology), University Hospitals-Cleveland, Cleaveland, United States","Cardiovascular magnetic resonance (CMR) has been utilized in the management and care of pediatric patients for nearly 40 years. It has evolved to become an invaluable tool in the assessment of the littlest of hearts for diagnosis, pre-interventional management and follow-up care. Although mentioned in a number of consensus and guidelines documents, an up-to-date, large, stand-alone guidance work for the use of CMR in pediatric congenital 36 and acquired 35 heart disease endorsed by numerous Societies involved in the care of these children is lacking. This guidelines document outlines the use of CMR in this patient population for a significant number of heart lesions in this age group and although admittedly, is not an exhaustive treatment, it does deal with an expansive list of many common clinical issues encountered in daily practice. © 2022, The Author(s).","Acquired pediatric heart disease; Cardiac magnetic resonance; Children; Congenital heart disease; Pediatrics","cardiology; child; diagnostic imaging; echocardiography; heart disease; human; medical society; North America; nuclear magnetic resonance spectroscopy; predictive value; radiology; United States; American Heart Association; Cardiology; Child; Echocardiography; Heart Diseases; Humans; Magnetic Resonance Spectroscopy; North America; Predictive Value of Tests; Radiology; United States","Fogel, M.A.; Departments of Pediatrics (Cardiology) and Radiology, United States; email: fogel@chop.edu",,"BioMed Central Ltd",10976647,,JCMRF,"35725473","English","J. Cardiovasc. Magn. Reson.",Review,"Final","All Open Access, Gold, Green",Scopus,2-s2.0-85132162210
"Jaubert O., Montalt-Tordera J., Brown J., Knight D., Arridge S., Steeden J., Muthurangu V.","48461323600;57204789341;57212760167;55589453200;7005759823;36605240600;7801671480;","FReSCO: Flow Reconstruction and Segmentation for low-latency Cardiac Output monitoring using deep artifact suppression and segmentation",2022,"Magnetic Resonance in Medicine","88","5",,"2179","2189",,,"10.1002/mrm.29374","https://www.scopus.com/inward/record.uri?eid=2-s2.0-85133371292&doi=10.1002%2fmrm.29374&partnerID=40&md5=d720817d1d94caa62a13453578bb3f80","UCL Center for Translational Cardiovascular Imaging, University College London, London, United Kingdom; Department of Computer Science, University College London, London, United Kingdom; Department of Cardiology, Royal Free London NHS Foundation Trust, London, United Kingdom","Jaubert, O., UCL Center for Translational Cardiovascular Imaging, University College London, London, United Kingdom, Department of Computer Science, University College London, London, United Kingdom; Montalt-Tordera, J., UCL Center for Translational Cardiovascular Imaging, University College London, London, United Kingdom; Brown, J., Department of Cardiology, Royal Free London NHS Foundation Trust, London, United Kingdom; Knight, D., Department of Cardiology, Royal Free London NHS Foundation Trust, London, United Kingdom; Arridge, S., Department of Computer Science, University College London, London, United Kingdom; Steeden, J., UCL Center for Translational Cardiovascular Imaging, University College London, London, United Kingdom; Muthurangu, V., UCL Center for Translational Cardiovascular Imaging, University College London, London, United Kingdom, Department of Cardiology, Royal Free London NHS Foundation Trust, London, United Kingdom","Purpose: Real-time monitoring of cardiac output (CO) requires low-latency reconstruction and segmentation of real-time phase-contrast MR, which has previously been difficult to perform. Here we propose a deep learning framework for “FReSCO” (Flow Reconstruction and Segmentation for low latency Cardiac Output monitoring). Methods: Deep artifact suppression and segmentation U-Nets were independently trained. Breath-hold spiral phase-contrast MR data (N = 516) were synthetically undersampled using a variable-density spiral sampling pattern and gridded to create aliased data for training of the artifact suppression U-net. A subset of the data (N = 96) was segmented and used to train the segmentation U-net. Real-time spiral phase-contrast MR was prospectively acquired and then reconstructed and segmented using the trained models (FReSCO) at low latency at the scanner in 10 healthy subjects during rest, exercise, and recovery periods. Cardiac output obtained via FReSCO was compared with a reference rest CO and rest and exercise compressed-sensing CO. Results: The FReSCO framework was demonstrated prospectively at the scanner. Beat-to-beat heartrate, stroke volume, and CO could be visualized with a mean latency of 622 ms. No significant differences were noted when compared with reference at rest (bias = −0.21 ± 0.50 L/min, p = 0.246) or compressed sensing at peak exercise (bias = 0.12 ± 0.48 L/min, p = 0.458). Conclusions: The FReSCO framework was successfully demonstrated for real-time monitoring of CO during exercise and could provide a convenient tool for assessment of the hemodynamic response to a range of stressors. © 2022 The Authors. Macromolecular Symposia published by Wiley-VCH GmbH.","Cardiac MRI; Cardiac output; deep learning; Flow imaging; monitoring; real-time","Deep learning; Heart; Hemodynamics; Magnetic resonance imaging; Scanning; Artifact suppression; Cardiac MRI; Cardiac output; Deep learning; Flow imaging; Flow reconstruction; Low latency; Phase-contrast; Real time monitoring; Real- time; Compressed sensing; adult; article; artifact reduction; breath holding; cardiovascular magnetic resonance; controlled study; deep learning; exercise; exercise recovery; female; heart output; heart stroke volume; hemodynamics; human; human experiment; major clinical study; male; artifact; cine magnetic resonance imaging; heart output; image processing; Artifacts; Breath Holding; Cardiac Output; Humans; Image Processing, Computer-Assisted; Magnetic Resonance Imaging, Cine; Stroke Volume","Jaubert, O.; UCL Center for Translational Cardiovascular Imaging, United Kingdom; email: o.jaubert@ucl.ac.uk",,"John Wiley and Sons Inc",07403194,,MRMEE,"35781891","English","Magn. Reson. Med.",Article,"Final","All Open Access, Green",Scopus,2-s2.0-85133371292
"Constantine A., Dimopoulos K., Haworth S.G., Muthurangu V., Moledina S.","36817914800;26642912600;57898812800;7801671480;23985897400;","Twenty-Year Experience and Outcomes in a National Pediatric Pulmonary Hypertension Service",2022,"American Journal of Respiratory and Critical Care Medicine","206","6",,"758","766",,4,"10.1164/rccm.202110-2428OC","https://www.scopus.com/inward/record.uri?eid=2-s2.0-85137757566&doi=10.1164%2frccm.202110-2428OC&partnerID=40&md5=3d27c3bcdab4b2078ec1c6e4b0f4a7af","National Pediatric Pulmonary Hypertension Service UK, Great Ormond Street Hospital for Children National Health Service Foundation Trust, London, United Kingdom; Adult Congenital Heart Centre, Centre for Pulmonary Hypertension, Royal Brompton and Harefield Hospitals, Guy’s and St. Thomas’ National Health Service Foundation Trust, London, United Kingdom; National Heart and Lung Institute, Faculty of Medicine, Imperial College London, London, United Kingdom; University College London, Institute of Cardiovascular Science, University College London, London, United Kingdom","Constantine, A., National Pediatric Pulmonary Hypertension Service UK, Great Ormond Street Hospital for Children National Health Service Foundation Trust, London, United Kingdom, Adult Congenital Heart Centre, Centre for Pulmonary Hypertension, Royal Brompton and Harefield Hospitals, Guy’s and St. Thomas’ National Health Service Foundation Trust, London, United Kingdom, National Heart and Lung Institute, Faculty of Medicine, Imperial College London, London, United Kingdom; Dimopoulos, K., Adult Congenital Heart Centre, Centre for Pulmonary Hypertension, Royal Brompton and Harefield Hospitals, Guy’s and St. Thomas’ National Health Service Foundation Trust, London, United Kingdom, National Heart and Lung Institute, Faculty of Medicine, Imperial College London, London, United Kingdom; Haworth, S.G., National Pediatric Pulmonary Hypertension Service UK, Great Ormond Street Hospital for Children National Health Service Foundation Trust, London, United Kingdom; Muthurangu, V., University College London, Institute of Cardiovascular Science, University College London, London, United Kingdom; Moledina, S., National Pediatric Pulmonary Hypertension Service UK, Great Ormond Street Hospital for Children National Health Service Foundation Trust, London, United Kingdom, University College London, Institute of Cardiovascular Science, University College London, London, United Kingdom","Rationale: Pediatric pulmonary hypertension is an important cause of childhood morbidity and mortality, but there are limited data on the range of associated diseases, contributions of different pulmonary hypertension subtypes, therapeutic strategies, and clinical outcomes in children. Objectives: To report the 20-year experience of a large UK National Pediatric Pulmonary Hypertension Service focusing on epidemiology and clinical outcomes. Methods: Consecutive patients presenting between 2001 and 2021 were included, and survival analysis was performed for incident patients. Measurements and Main Results: Of 1,353 patients assessed, a pulmonary hypertension diagnosis was made in 1,101 (81.4%) patients (51% female, median age, 2.6 [interquartile range, 0.8–8.2] years). The most common form was pulmonary arterial hypertension in 48%, followed by 32.3% with pulmonary hypertension due to lung disease. Multiple contributory causes of pulmonary hypertension were common, with 16.9% displaying features of more than one diagnostic group. The annual incidence of childhood pulmonary hypertension was 3.5 (95% confidence interval [CI], 3.3–3.8) per 1 million children, and the prevalence was 18.1 (95% CI, 15.8–20.4) per 1 million. The incidence was highest for pulmonary hypertension due to lung disease in infancy (15.0 [95% CI, 12.7–17.2] per 1 million per year). Overall, 82.4% patients received pulmonary arterial hypertension therapy, and escalation to triple therapy during follow-up was required in 13.1%. In 970 (88.1%) incident patients, transplant-free survival was 86.7% (95% CI, 84.5–89%) at 1 and 68.6% (95% CI, 64.7–72.6%) at 10 years. Pulmonary hypertension due to left heart disease had the lowest survival (hazard ratio, 2.0; 95% CI, 1.36–2.94; P, 0.001). Conclusions: Clinical phenotypes of pediatric pulmonary hypertension are heterogeneous and overlapping, with clinical phenotypes that evolve throughout childhood. Despite widespread use of pulmonary arterial hypertension therapy, the prognosis remains poor. Copyright © 2022 by the American Thoracic Society.","adolescent medicine; cohort study; epidemiology; pulmonary arterial hypertension; survival analysis","endothelin receptor antagonist; phosphodiesterase V inhibitor; prostanoid; Article; child; clinical feature; clinical outcome; cohort analysis; diagnosis related group; female; heart disease; human; incidence; infant; lung disease; major clinical study; male; newborn; outcome assessment; phenotype; prevalence; pulmonary hypertension; retrospective study; survival analysis; transplant free survival; United Kingdom; complication; pulmonary hypertension; risk factor; Familial Primary Pulmonary Hypertension; Female; Humans; Hypertension, Pulmonary; Incidence; Male; Pulmonary Arterial Hypertension; Risk Factors","Moledina, S.; National Pediatric Pulmonary Hypertension Service UK, Great Ormond Street, United Kingdom; email: s.moledina@ucl.ac.uk
Gern, D.email: dgern@thoracic.org",,"American Thoracic Society",1073449X,,AJCME,"35579610","English","Am. J. Respir. Crit. Care Med.",Article,"Final","All Open Access, Hybrid Gold",Scopus,2-s2.0-85137757566
"Baritussio A., Muthurangu V.","57211083589;7801671480;","Cardiovascular magnetic resonance for the assessment of left ventricular filling pressure in heart failure",2022,"European Heart Journal","43","26",,"2523","2525",,1,"10.1093/eurheartj/ehac247","https://www.scopus.com/inward/record.uri?eid=2-s2.0-85134360711&doi=10.1093%2feurheartj%2fehac247&partnerID=40&md5=1fd3193bfe92ed4c91bc5d3419908174","Cardiology, Department of Cardiac, Thoracic, Vascular Sciences and Public Health, University of Padua, Padua, Italy; Ucl Centre for Cardiovascular Imaging, Institute of Cardiovascular Science, University College London, Gower St, London, WC1E 6BT, United Kingdom","Baritussio, A., Cardiology, Department of Cardiac, Thoracic, Vascular Sciences and Public Health, University of Padua, Padua, Italy; Muthurangu, V., Ucl Centre for Cardiovascular Imaging, Institute of Cardiovascular Science, University College London, Gower St, London, WC1E 6BT, United Kingdom",[No abstract available],,"atrial fibrillation; atrioventricular block; cardiovascular magnetic resonance; diagnostic accuracy; diastolic dysfunction; echocardiography; heart catheterization; heart failure; heart failure with preserved ejection fraction; heart failure with reduced ejection fraction; heart transplantation; heart ventricle hypertrophy; human; left ventricular filling pressure; mitral valve stenosis; multiple linear regression analysis; predictive model; predictive value; proportional hazards model; pulmonary artery occlusion pressure; Review; heart; heart stroke volume; nuclear magnetic resonance spectroscopy; pathophysiology; prognosis; Heart; Heart Failure; Humans; Magnetic Resonance Spectroscopy; Prognosis; Stroke Volume","Muthurangu, V.; Ucl Centre for Cardiovascular Imaging, Gower St, United Kingdom; email: v.muthurangu@ucl.ac.uk",,"Oxford University Press",0195668X,,EHJOD,"35574820","English","Eur. Heart J.",Review,"Final","",Scopus,2-s2.0-85134360711
"Fogel M.A., Anwar S., Broberg C., Browne L., Chung T., Johnson T., Muthurangu V., Taylor M., Valsangiacomo-Buechel E., Wilhelm C.","7102455134;57748760900;6602638135;23491352300;7401571182;34975456500;7801671480;35396633800;10044074500;56956505100;","Society for Cardiovascular Magnetic Resonance/European Society of Cardiovascular Imaging/American Society of Echocardiography/Society for Pediatric Radiology/North American Society for Cardiovascular Imaging Guidelines for the Use of Cardiac Magnetic Resonance in Pediatric Congenital and Acquired Heart Disease: Endorsed by The American Heart Association",2022,"Circulation: Cardiovascular Imaging","15","6",,"E014415","",,,"10.1161/CIRCIMAGING.122.014415","https://www.scopus.com/inward/record.uri?eid=2-s2.0-85132275268&doi=10.1161%2fCIRCIMAGING.122.014415&partnerID=40&md5=9079e034e352c6f0c00ad17ca11eb634","Departments of Pediatrics (Cardiology) and Radiology, Perelman School of Medicine, University of Pennsylvania, Philadelphia, PA, United States; Division of Cardiology, Department of Pediatrics, Children's Hospital of Philadelphia, Philadelphia, PA, United States; Department of Pediatrics (Cardiology) and Radiology, University of California, San Francisco School of Medicine, San Francisco, United States; Division of Cardiovascular Medicine, Oregon Health and Sciences University, Portland, United States; Department of Radiology, University of Colorado, Denver, United States; Department of Radiology and Biomedical Imaging, University of California, San Francisco School of Medicine, San Francisco, United States; Department of Pediatrics (Cardiology), Indiana University, School of Medicine, Indianapolis, United States; Department of Pediatrics (Cardiology), University College London, London, United Kingdom; Department of Pediatrics (Cardiology), University of Cincinnati, School of Medicine, Cincinnati, United States; Department of Diagnostic Imaging, University of Zurich, Zurich, Switzerland; Department of Pediatrics (Cardiology), University Hospitals-Cleveland, Cleaveland, United States","Fogel, M.A., Departments of Pediatrics (Cardiology) and Radiology, Perelman School of Medicine, University of Pennsylvania, Philadelphia, PA, United States, Division of Cardiology, Department of Pediatrics, Children's Hospital of Philadelphia, Philadelphia, PA, United States; Anwar, S., Department of Pediatrics (Cardiology) and Radiology, University of California, San Francisco School of Medicine, San Francisco, United States; Broberg, C., Division of Cardiovascular Medicine, Oregon Health and Sciences University, Portland, United States; Browne, L., Department of Radiology, University of Colorado, Denver, United States; Chung, T., Department of Radiology and Biomedical Imaging, University of California, San Francisco School of Medicine, San Francisco, United States; Johnson, T., Department of Pediatrics (Cardiology), Indiana University, School of Medicine, Indianapolis, United States; Muthurangu, V., Department of Pediatrics (Cardiology), University College London, London, United Kingdom; Taylor, M., Department of Pediatrics (Cardiology), University of Cincinnati, School of Medicine, Cincinnati, United States; Valsangiacomo-Buechel, E., Department of Diagnostic Imaging, University of Zurich, Zurich, Switzerland; Wilhelm, C., Department of Pediatrics (Cardiology), University Hospitals-Cleveland, Cleaveland, United States","Cardiovascular magnetic resonance has been utilized in the management and care of pediatric patients for nearly 40 years. It has evolved to become an invaluable tool in the assessment of the littlest of hearts for diagnosis, pre-interventional management and follow-up care. Although mentioned in a number of consensus and guidelines documents, an up-to-date, large, stand-alone guidance work for the use of cardiovascular magnetic resonance in pediatric congenital 36 and acquired 35 heart disease endorsed by numerous Societies involved in the care of these children is lacking. This guidelines document outlines the use of cardiovascular magnetic resonance in this patient population for a significant number of heart lesions in this age group and although admittedly, is not an exhaustive treatment, it does deal with an expansive list of many common clinical issues encountered in daily practice. © 2022 Asia-Pacific Academy of Ophthalmology.","acquired pediatric heart disease; cardiac magnetic resonance; children; congenital heart disease; pediatrics","acquired pediatric heart disease; American society of echocardiography; aortic dissection; aortic root calcification; bicuspid aortic valve; cardiac fibroma; cardiomyopathy; cardiovascular disease; cardiovascular magnetic resonance; cardiovascular parameters; cell viability; child; childhood disease; congenital heart disease; coronary artery; coronary artery disease; diagnostic imaging; diastolic dysfunction; Duchenne muscular dystrophy; Ehlers Danlos syndrome; end-diastolic velocity; European society of cardiovascular imaging; evidence based practice; follow up; great vessels transposition; health care organization; heart ejection fraction; heart failure; heart injury; heart left ventricle; heart left ventricle outflow tract obstruction; heart left ventricle volume; heart muscle fibrosis; heart muscle perfusion; heart right ventricle; heart right ventricle function; heart single ventricle; heart tumor; heart ventricle function; heart ventricle septum defect; hemodynamics; human; hypertrophic cardiomyopathy; late gadolinium enhancement imaging; Loeys Dietz syndrome; lung blood flow; lung vein drainage anomaly; management; Marfan syndrome; medical society; mucocutaneous lymph node syndrome; myocarditis; neuromuscular disease; Noonan syndrome; North American society for cardiovascular imaging; osteoarthritis; pediatric patient; pediatrics; pericardial disease; practice guideline; pulmonary valve; pulmonary vein malformation; Review; right pulmonary artery; scientific literature; shunting; society for pediatric radiology; systemic vascular resistance; T2 weighted imaging; thoracic aorta aneurysm; Turner syndrome; valvular heart disease; cardiology; echocardiography; heart disease; North America; nuclear magnetic resonance spectroscopy; radiology; United States; American Heart Association; Cardiology; Child; Echocardiography; Heart Diseases; Humans; Magnetic Resonance Spectroscopy; North America; Radiology; Societies, Medical; United States","Fogel, M.A.; Departments of Pediatrics (Cardiology) and Radiology, United States; email: fogel@chop.edu",,"Lippincott Williams and Wilkins",19419651,,,"35727874","English","Circ. Cardiovasc. Imaging",Review,"Final","All Open Access, Hybrid Gold, Green",Scopus,2-s2.0-85132275268
