"Knight D.S., Kotecha T., Martinez-Naharro A., Brown J.T., Bertelli M., Fontana M., Muthurangu V., Coghlan J.G.","55589453200;38661453500;55343433500;57212760167;57222484787;16306839900;7801671480;35393553500;","Cardiovascular magnetic resonance-guided right heart catheterization in a conventional CMR environment - Predictors of procedure success and duration in pulmonary artery hypertension",2019,"Journal of Cardiovascular Magnetic Resonance","21","1","57","","",,17,"10.1186/s12968-019-0569-9","https://www.scopus.com/inward/record.uri?eid=2-s2.0-85071896462&doi=10.1186%2fs12968-019-0569-9&partnerID=40&md5=1dc1772e143ee54bdea7966b03b91d36","National Pulmonary Hypertension Service, Royal Free London NHS Foundation Trust, Pond Street, London, NW3 2QG, United Kingdom; Department of Cardiology, Royal Free London NHS Foundation Trust, Pond Street, London, NW3 2QG, United Kingdom; UCL Department of Cardiac MRI, University College London, Royal Free Campus, Rowland Hill Street, London, NW3 2PF, United Kingdom; Centre for Cardiovascular Imaging, Institute of Cardiovascular Science, University College London and Great Ormond Street, Hospital for Children, 30 Guilford Street, London, WC1N 1EH, United Kingdom","Knight, D.S., National Pulmonary Hypertension Service, Royal Free London NHS Foundation Trust, Pond Street, London, NW3 2QG, United Kingdom, Department of Cardiology, Royal Free London NHS Foundation Trust, Pond Street, London, NW3 2QG, United Kingdom, UCL Department of Cardiac MRI, University College London, Royal Free Campus, Rowland Hill Street, London, NW3 2PF, United Kingdom; Kotecha, T., Department of Cardiology, Royal Free London NHS Foundation Trust, Pond Street, London, NW3 2QG, United Kingdom, UCL Department of Cardiac MRI, University College London, Royal Free Campus, Rowland Hill Street, London, NW3 2PF, United Kingdom; Martinez-Naharro, A., UCL Department of Cardiac MRI, University College London, Royal Free Campus, Rowland Hill Street, London, NW3 2PF, United Kingdom; Brown, J.T., National Pulmonary Hypertension Service, Royal Free London NHS Foundation Trust, Pond Street, London, NW3 2QG, United Kingdom, Department of Cardiology, Royal Free London NHS Foundation Trust, Pond Street, London, NW3 2QG, United Kingdom, UCL Department of Cardiac MRI, University College London, Royal Free Campus, Rowland Hill Street, London, NW3 2PF, United Kingdom; Bertelli, M., UCL Department of Cardiac MRI, University College London, Royal Free Campus, Rowland Hill Street, London, NW3 2PF, United Kingdom; Fontana, M., UCL Department of Cardiac MRI, University College London, Royal Free Campus, Rowland Hill Street, London, NW3 2PF, United Kingdom; Muthurangu, V., Centre for Cardiovascular Imaging, Institute of Cardiovascular Science, University College London and Great Ormond Street, Hospital for Children, 30 Guilford Street, London, WC1N 1EH, United Kingdom; Coghlan, J.G., National Pulmonary Hypertension Service, Royal Free London NHS Foundation Trust, Pond Street, London, NW3 2QG, United Kingdom, Department of Cardiology, Royal Free London NHS Foundation Trust, Pond Street, London, NW3 2QG, United Kingdom","Background: Cardiovascular magnetic resonance imaging (CMR) is valuable for the investigation and management of pulmonary artery hypertension (PAH), but the direct measurement of pulmonary hemodynamics by right heart catheterization is still necessary. CMR-guided right heart catheterization (CMR-RHC) combines the benefits of CMR and invasive cardiac catheterization, but its feasibility in patients with acquired PAH has not been established. The aims of this study are to: (1) demonstrate the feasibility of CMR-RHC in patients being assessed for PAH in a conventional diagnostic CMR scanner room; (2) determine the predictors of (i) procedure duration, and (ii) procedural failure or technical difficulty as determined by the adjunctive need for a guidewire. Methods: Fifty patients investigated for suspected or known PH underwent CMR-RHC. Durations of separate procedural components were recorded, including time taken to pass the catheter from the femoral vein to a stable wedge position (procedure time) and total time the patient spent in the CMR department (department time). Associations between procedural failure/guidewire usage and hemodynamic/CMR measures were assessed using logistic regression. Relationships between procedure times and hemodynamic/CMR measures were evaluated using Spearman's correlation coefficient. Results: A full CMR-RHC study was successfully completed in 47 (94%) patients. CMR-conditional guidewires were used in 6 (12%) patients. Metrics associated with guidewire use/procedural failure were higher mean pulmonary artery (PA) pressures (mPAP: OR = 1.125, p = 0.018), right heart dilatation (right ventricular (RV) end-systolic volume (RVESV): OR = 1.028, p = 0.018), RV hypertrophy (OR = 1.050, p = 0.0067) and RV ejection fraction (EF) (OR = 0.914, p = 0.014). Median catheter and department times were 3.6 (2.0-7.7) minutes and 60.0 (54.0-68.5) minutes, respectively. All procedure times became significantly shorter with increasing procedural experience (p < 0.05). Catheterization time was also associated with PH severity (RV systolic pressure: rho = 0.46, p = 0.0013) and increasing RV end-systolic volume (RVESV: rho = 0.41, p = 0.0043), hypertrophy (rho = 0.43, p = 0.0025) and dysfunction (RVEF: rho = - 0.32, p = 0.031). Conclusions: This study demonstrates that CMR-RHC using standard technology can be incorporated into routine clinical practice for the investigation of PAH. Procedural failure was rare but more likely in patients with severe PAH. Procedure time is clinically acceptable and increases with worsening PAH severity. © 2019 The Author(s).","Cardiovascular magnetic resonance imaging; Guidewire; Interventional cardiovascular MR catheterization; Pulmonary hypertension; Right heart catheterization","adult; adverse event; aged; arterial pressure; diagnostic imaging; feasibility study; female; heart catheterization; human; interventional magnetic resonance imaging; male; middle aged; pathophysiology; predictive value; procedures; prognosis; pulmonary artery; pulmonary hypertension; time factor; very elderly; workflow; young adult; Adult; Aged; Aged, 80 and over; Arterial Pressure; Cardiac Catheterization; Feasibility Studies; Female; Humans; Magnetic Resonance Imaging, Interventional; Male; Middle Aged; Predictive Value of Tests; Prognosis; Pulmonary Arterial Hypertension; Pulmonary Artery; Time Factors; Workflow; Young Adult","Muthurangu, V.; Centre for Cardiovascular Imaging, 30 Guilford Street, United Kingdom; email: v.muthurangu@ucl.ac.uk",,"BioMed Central Ltd.",10976647,,JCMRF,"31495338","English","J. Cardiovasc. Magn. Reson.",Article,"Final","All Open Access, Gold, Green",Scopus,2-s2.0-85071896462
"Hughes M.L., Broadhead M., McEwan A., Tann O., Krupickova S., Muthurangu V.","7402467863;6701455088;7102063096;24339325500;33667688400;7801671480;","Pre-Operative Grade of Decompressing Systemic Venous Collaterals, But Not Jugular Venous Pressure, Predicts Short- and Medium-Term Outcome After Completion of the Total Cavopulmonary Connection",2019,"JACC: Cardiovascular Imaging","12","6",,"1109","1111",,2,"10.1016/j.jcmg.2018.12.017","https://www.scopus.com/inward/record.uri?eid=2-s2.0-85065916981&doi=10.1016%2fj.jcmg.2018.12.017&partnerID=40&md5=a0f398c90a9ef8ffb9c43aea63a87252",,"Hughes, M.L.; Broadhead, M.; McEwan, A.; Tann, O.; Krupickova, S.; Muthurangu, V.",[No abstract available],,"gadolinium; cardiac imaging; cardiovascular magnetic resonance; cavopulmonary connection; central venous pressure; clinical outcome; collateral vein; contrast enhancement; fenestration; human; length of stay; Letter; magnetic resonance angiography; major clinical study; priority journal; adverse event; child; collateral circulation; congenital heart malformation; diagnostic imaging; extracorporeal circulation; female; heart transplantation; heart ventricle; jugular vein; male; mortality; nuclear magnetic resonance imaging; pathophysiology; preschool child; reoperation; superior cava vein; time factor; treatment outcome; venous pressure; Child; Child, Preschool; Collateral Circulation; Female; Heart Bypass, Right; Heart Defects, Congenital; Heart Transplantation; Heart Ventricles; Humans; Jugular Veins; Length of Stay; Magnetic Resonance Imaging; Male; Reoperation; Time Factors; Treatment Outcome; Vena Cava, Superior; Venous Pressure","Hughes, M.L.; Cardiorespiratory Unit, Great Ormond Street, United Kingdom; email: marina.hughes@gosh.nhs.uk",,"Elsevier Inc.",1936878X,,,"30772223","English","JACC Cardiovasc. Imaging",Letter,"Final","All Open Access, Green",Scopus,2-s2.0-85065916981
"Quail M.A., Segers P., Steeden J.A., Muthurangu V.","35380885000;7005378428;36605240600;7801671480;","Erratum: The aorta after coarctation repair - Effects of calibre and curvature on arterial haemodynamics (Journal of Cardiovascular Magnetic Resonance (2019) 21:22 DOI: 10.1186/s12968-019-0534-7)",2019,"Journal of Cardiovascular Magnetic Resonance","21","1","31","","",,,"10.1186/s12968-019-0540-9","https://www.scopus.com/inward/record.uri?eid=2-s2.0-85066403605&doi=10.1186%2fs12968-019-0540-9&partnerID=40&md5=5b8fde0611f7a6ca2db39ab501fe2632","Centre for Translational Cardiovascular Imaging, Institute of Cardiovascular Science, University College London, Great Ormond Street Hospital for Children, London, WC1N 3JH, United Kingdom; IBiTech-bioMMeda, IMinds Medical IT, Ghent University, De Pintelaan 185, Ghent, 9000, Belgium","Quail, M.A., Centre for Translational Cardiovascular Imaging, Institute of Cardiovascular Science, University College London, Great Ormond Street Hospital for Children, London, WC1N 3JH, United Kingdom; Segers, P., IBiTech-bioMMeda, IMinds Medical IT, Ghent University, De Pintelaan 185, Ghent, 9000, Belgium; Steeden, J.A., Centre for Translational Cardiovascular Imaging, Institute of Cardiovascular Science, University College London, Great Ormond Street Hospital for Children, London, WC1N 3JH, United Kingdom; Muthurangu, V., Centre for Translational Cardiovascular Imaging, Institute of Cardiovascular Science, University College London, Great Ormond Street Hospital for Children, London, WC1N 3JH, United Kingdom","In the original version of this article [1], published on 11 April 2019, there is 1 error in the 'Conclusion' paragraph of the abstract. The wording of the abstract in the original publication is as followed - There are major modes of variation in 3D aortic shape after coarctation repair with a modest association between variation in aortic radius and pathological wave reflections, but not with 3D curvature. The corrected information is as followed: - We have demonstrated the major modes of variation in 3D aortic shape after coarctation repair. There exists a modest association between variation in aortic radius and pathological wave reflections but not with 3D curvature. © 2019 The Author(s).",,"erratum; error","Muthurangu, V.; Centre for Translational Cardiovascular Imaging, United Kingdom; email: v.muthurangu@ucl.ac.uk",,"BioMed Central Ltd.",10976647,,JCMRF,"31122264","English","J. Cardiovasc. Magn. Reson.",Erratum,"Final","All Open Access, Gold, Green",Scopus,2-s2.0-85066403605
"Cheang M.H., Kowalik G.T., Quail M.A., Steeden J.A., Hothi D., Tullus K., Muthurangu V.","56976091500;6602362169;35380885000;36605240600;13604772600;16409790600;7801671480;","The cardiovascular phenotype of childhood hypertension: a cardiac magnetic resonance study",2019,"Pediatric Radiology","49","6",,"727","736",,3,"10.1007/s00247-019-04393-6","https://www.scopus.com/inward/record.uri?eid=2-s2.0-85065341820&doi=10.1007%2fs00247-019-04393-6&partnerID=40&md5=0082d6efcc9bbe19ba594a6869c5d533","Centre for Cardiovascular Imaging, University College London Institute of Cardiovascular Science and Great Ormond Street Hospital for Children, 30 Guilford Street London, London, WC1N 1EH, United Kingdom; Nephrology Department, Great Ormond Street Hospital, London, United Kingdom","Cheang, M.H., Centre for Cardiovascular Imaging, University College London Institute of Cardiovascular Science and Great Ormond Street Hospital for Children, 30 Guilford Street London, London, WC1N 1EH, United Kingdom; Kowalik, G.T., Centre for Cardiovascular Imaging, University College London Institute of Cardiovascular Science and Great Ormond Street Hospital for Children, 30 Guilford Street London, London, WC1N 1EH, United Kingdom; Quail, M.A., Centre for Cardiovascular Imaging, University College London Institute of Cardiovascular Science and Great Ormond Street Hospital for Children, 30 Guilford Street London, London, WC1N 1EH, United Kingdom; Steeden, J.A., Centre for Cardiovascular Imaging, University College London Institute of Cardiovascular Science and Great Ormond Street Hospital for Children, 30 Guilford Street London, London, WC1N 1EH, United Kingdom; Hothi, D., Nephrology Department, Great Ormond Street Hospital, London, United Kingdom; Tullus, K., Nephrology Department, Great Ormond Street Hospital, London, United Kingdom; Muthurangu, V., Centre for Cardiovascular Imaging, University College London Institute of Cardiovascular Science and Great Ormond Street Hospital for Children, 30 Guilford Street London, London, WC1N 1EH, United Kingdom","Background: The cardiovascular phenotype is poorly characterized in treated pediatric hypertension. Cardiovascular magnetic resonance imaging (MRI) can be used to better characterize both cardiac and vascular phenotype in children with hypertension. Objective: To use MRI to determine the cardiac and vascular phenotypes of different forms of treated hypertension and compare the results with those of healthy children. Materials and methods: Sixty children (15 with chronic renal disease with hypertension, 15 with renovascular hypertension, 15 with essential hypertension and 15 healthy subjects) underwent MRI with noninvasive blood pressure measurements. Cardiovascular parameters measured include systemic vascular resistance, total arterial compliance, left ventricular mass and volumetric data, ejection fraction and myocardial velocity. Between-group comparisons were used to investigate differences in the hypertension types. Results: Renal hypertension was associated with elevated vascular resistance (P≤0.007) and normal arterial compliance. Conversely, children with essential hypertension had normal resistance but increased compliance (P=0.001). Renovascular hypertension was associated with both increased resistance and compliance (P≤0.03). There was no difference in ventricular volumes, mass or cardiac output between groups. Children with renal hypertension also had lower systolic and diastolic myocardial velocities. Conclusion: Cardiovascular MRI may identify distinct vascular and cardiac phenotypes in different forms of treated childhood hypertension. Future studies are needed to investigate how this may inform further optimisation of blood pressure treatment in different types of hypertension. © 2019, The Author(s).","Aortic stiffness; Child; Chronic kidney disease; Hypertension; Magnetic resonance imaging; Renal artery stenosis; Systemic vascular resistance","angiotensin 2 receptor antagonist; beta adrenergic receptor blocking agent; calcium channel blocking agent; dipeptidyl carboxypeptidase inhibitor; antihypertensive therapy; aortic flow; artery compliance; Article; blood pressure measurement; cardiovascular magnetic resonance; cardiovascular parameters; child; chronic kidney failure; cohort analysis; comparative study; controlled study; diastolic blood pressure; essential hypertension; female; heart ejection fraction; heart left ventricle mass; heart left ventricle outflow tract; heart left ventricle volume; heart output; heart stroke volume; human; major clinical study; male; mean arterial pressure; myocardial velocity; non invasive measurement; priority journal; renovascular hypertension; school child; systemic vascular resistance; systolic blood pressure; vascular resistance; adolescent; aorta; blood flow velocity; case control study; diagnostic imaging; heart ventricle; hypertension; nuclear magnetic resonance imaging; pathophysiology; phenotype; procedures; renovascular hypertension; respiratory gated imaging; Adolescent; Aorta; Blood Flow Velocity; Case-Control Studies; Child; Female; Heart Ventricles; Humans; Hypertension; Hypertension, Renovascular; Magnetic Resonance Imaging; Male; Phenotype; Respiratory-Gated Imaging Techniques; Stroke Volume; Vascular Resistance","Muthurangu, V.; Centre for Cardiovascular Imaging, 30 Guilford Street London, United Kingdom; email: v.muthurangu@ucl.ac.uk",,"Springer Verlag",03010449,,PDRYA,"31053874","English","Pediatr. Radiol.",Article,"Final","All Open Access, Hybrid Gold, Green",Scopus,2-s2.0-85065341820
"Knight D.S., Zumbo G., Barcella W., Steeden J.A., Muthurangu V., Martinez-Naharro A., Treibel T.A., Abdel-Gadir A., Bulluck H., Kotecha T., Francis R., Rezk T., Quarta C.C., Whelan C.J., Lachmann H.J., Wechalekar A.D., Gillmore J.D., Moon J.C., Hawkins P.N., Fontana M.","55589453200;57193211591;56768040900;36605240600;7801671480;55343433500;15754511800;56528300800;53981151600;38661453500;57194779300;55985701600;56619484400;36647033100;7004915734;6506002568;7003539031;7403231345;35464959200;16306839900;","Cardiac Structural and Functional Consequences of Amyloid Deposition by Cardiac Magnetic Resonance and Echocardiography and Their Prognostic Roles",2019,"JACC: Cardiovascular Imaging","12","5",,"823","833",,62,"10.1016/j.jcmg.2018.02.016","https://www.scopus.com/inward/record.uri?eid=2-s2.0-85045306445&doi=10.1016%2fj.jcmg.2018.02.016&partnerID=40&md5=3621ca666fddf92bb53f446160b49793","National Amyloidosis Centre, University College London, Royal Free Hospital, London, United Kingdom; Department of Statistical Science, University College London, United Kingdom; Centre for Cardiovascular Imaging, Institute of Cardiovascular Science, University College London and Great Ormond Street Hospital for Children, London, United Kingdom; Barts Heart Centre, St. Bartholomew's Hospital, London, United Kingdom; The Hatter Cardiovascular Institute, Institute of Cardiovascular Science, University College London, United Kingdom","Knight, D.S., National Amyloidosis Centre, University College London, Royal Free Hospital, London, United Kingdom; Zumbo, G., National Amyloidosis Centre, University College London, Royal Free Hospital, London, United Kingdom; Barcella, W., Department of Statistical Science, University College London, United Kingdom; Steeden, J.A., Centre for Cardiovascular Imaging, Institute of Cardiovascular Science, University College London and Great Ormond Street Hospital for Children, London, United Kingdom; Muthurangu, V., Centre for Cardiovascular Imaging, Institute of Cardiovascular Science, University College London and Great Ormond Street Hospital for Children, London, United Kingdom; Martinez-Naharro, A., National Amyloidosis Centre, University College London, Royal Free Hospital, London, United Kingdom; Treibel, T.A., Barts Heart Centre, St. Bartholomew's Hospital, London, United Kingdom; Abdel-Gadir, A., Barts Heart Centre, St. Bartholomew's Hospital, London, United Kingdom; Bulluck, H., The Hatter Cardiovascular Institute, Institute of Cardiovascular Science, University College London, United Kingdom; Kotecha, T., National Amyloidosis Centre, University College London, Royal Free Hospital, London, United Kingdom; Francis, R., National Amyloidosis Centre, University College London, Royal Free Hospital, London, United Kingdom; Rezk, T., National Amyloidosis Centre, University College London, Royal Free Hospital, London, United Kingdom; Quarta, C.C., National Amyloidosis Centre, University College London, Royal Free Hospital, London, United Kingdom; Whelan, C.J., National Amyloidosis Centre, University College London, Royal Free Hospital, London, United Kingdom; Lachmann, H.J., National Amyloidosis Centre, University College London, Royal Free Hospital, London, United Kingdom; Wechalekar, A.D., National Amyloidosis Centre, University College London, Royal Free Hospital, London, United Kingdom; Gillmore, J.D., National Amyloidosis Centre, University College London, Royal Free Hospital, London, United Kingdom; Moon, J.C., Barts Heart Centre, St. Bartholomew's Hospital, London, United Kingdom; Hawkins, P.N., National Amyloidosis Centre, University College London, Royal Free Hospital, London, United Kingdom; Fontana, M., National Amyloidosis Centre, University College London, Royal Free Hospital, London, United Kingdom","Objectives: This cross-sectional study aimed to describe the functional and structural cardiac abnormalities that occur across a spectrum of cardiac amyloidosis burden and to identify the strongest cardiac functional and structural prognostic predictors in amyloidosis using cardiac magnetic resonance (CMR) and echocardiography. Background: Cardiac involvement in light chain and transthyretin amyloidosis is the main driver of prognosis and influences treatment strategies. Numerous measures of cardiac structure and function are assessed by multiple imaging modalities in amyloidosis. Methods: A total f 322 subjects (311 systemic amyloidosis and 11 transthyretin gene mutation carriers) underwent comprehensive CMR and transthoracic echocardiography. The probabilities of 11 commonly measured structural and functional cardiac parameters being abnormal with increasing cardiac amyloidosis burden were evaluated. Cardiac amyloidosis burden was quantified using CMR-derived extracellular volume. The prognostic capacities of these parameters to predict death in amyloidosis were assessed using Cox proportional hazards models. Results: Left ventricular mass and mitral annular plane systolic excursion by CMR along with strain and E/e’ by echocardiography have high probabilities of being abnormal at low cardiac amyloid burden. Reductions in biventricular ejection fractions and elevations in biatrial areas occur at high burdens of infiltration. The probabilities of indexed stroke volume, myocardial contraction fraction, and tricuspid annular plane systolic excursion (TAPSE) being abnormal occur more gradually with increasing extracellular volume. Ninety patients (28%) died during a median follow-up of 22 months (interquartile range: 10 to 38 months). Univariable analysis showed that all imaging markers studied significantly predicted outcome. Multivariable analysis showed that TAPSE (hazard ratio: 1.46; 95% confidence interval: 1.16 to 1.85; p < 0.01) and indexed stroke volume (hazard ratio: 1.24; 95% confidence interval: 1.04 to 1.48; p < 0.05) by CMR were the only independent predictors of mortality. Conclusions: Specific functional and structural abnormalities characterize different burdens of cardiac amyloid deposition. In a multimodality imaging assessment of a large cohort of amyloidosis patients, CMR-derived TAPSE and indexed stroke volume are the strongest prognostic cardiac functional markers. © 2019 American College of Cardiology Foundation","amyloidosis; CMR; echocardiography; function; prognosis","amyloid; transthyretin; amyloid; adult; aged; amyloidosis; Article; cardiovascular magnetic resonance; cardiovascular mortality; cross-sectional study; disease burden; extracellular space; female; follow up; gene mutation; heart amyloidosis; heart contraction; heart ejection fraction; heart function; heart left ventricle mass; heart stroke volume; human; major clinical study; male; priority journal; prognosis; transthoracic echocardiography; tricuspid annular plane systolic excursion; AL amyloidosis; cardiac muscle; cardiomyopathy; chemistry; cine magnetic resonance imaging; diagnostic imaging; disease exacerbation; familial amyloid polyneuropathy; middle aged; mortality; pathology; pathophysiology; predictive value; prognosis; pulsed Doppler echocardiography; retrospective study; risk assessment; risk factor; severity of illness index; very elderly; Adult; Aged; Aged, 80 and over; Amyloid; Amyloid Neuropathies, Familial; Cardiomyopathies; Cross-Sectional Studies; Disease Progression; Echocardiography, Doppler, Pulsed; Female; Humans; Immunoglobulin Light-chain Amyloidosis; Magnetic Resonance Imaging, Cine; Male; Middle Aged; Myocardium; Predictive Value of Tests; Prognosis; Retrospective Studies; Risk Assessment; Risk Factors; Severity of Illness Index","Fontana, M.; Centre for Amyloidosis & Acute Phase Proteins, Rowland Hill Street, United Kingdom; email: m.fontana@ucl.ac.uk",,"Elsevier Inc.",1936878X,,,"29680336","English","JACC Cardiovasc. Imaging",Article,"Final","All Open Access, Bronze, Green",Scopus,2-s2.0-85045306445
