"Hauser J.A., Muthurangu V., Steeden J.A., Taylor A.M., Jones A.","37034141400;7801671480;36605240600;57195810900;12795736600;","Comprehensive assessment of the global and regional vascular responses to food ingestion in humans using novel rapid MRI",2016,"American Journal of Physiology - Regulatory Integrative and Comparative Physiology","310","6",,"R541","R545",,10,"10.1152/ajpregu.00454.2015","https://www.scopus.com/inward/record.uri?eid=2-s2.0-84984839778&doi=10.1152%2fajpregu.00454.2015&partnerID=40&md5=f34ce89ed605f6d6e3677b40b9e7b0fa","University College London, Institute of Cardiovascular Science, Centre for Cardiovascular Imaging, London, United Kingdom; Great Ormond Street Hospital for Children, Cardiorespiratory Division, London, United Kingdom","Hauser, J.A., University College London, Institute of Cardiovascular Science, Centre for Cardiovascular Imaging, London, United Kingdom, Great Ormond Street Hospital for Children, Cardiorespiratory Division, London, United Kingdom; Muthurangu, V., University College London, Institute of Cardiovascular Science, Centre for Cardiovascular Imaging, London, United Kingdom, Great Ormond Street Hospital for Children, Cardiorespiratory Division, London, United Kingdom; Steeden, J.A., University College London, Institute of Cardiovascular Science, Centre for Cardiovascular Imaging, London, United Kingdom, Great Ormond Street Hospital for Children, Cardiorespiratory Division, London, United Kingdom; Taylor, A.M., University College London, Institute of Cardiovascular Science, Centre for Cardiovascular Imaging, London, United Kingdom, Great Ormond Street Hospital for Children, Cardiorespiratory Division, London, United Kingdom; Jones, A., University College London, Institute of Cardiovascular Science, Centre for Cardiovascular Imaging, London, United Kingdom, Great Ormond Street Hospital for Children, Cardiorespiratory Division, London, United Kingdom","Ingestion of food is known to increase mesenteric blood flow. It is not clear whether this increased flow demand is compensated by a rise in cardiac output (CO) alone or by redistribution of blood flow from other organs. We used a new comprehensive imaging method to assess the human cardiovascular response to food ingestion. Following a 12-h fast, blood flow in segments of the aorta and in organspecific arteries, and ventricular volumes were assessed in 20 healthy adults using MRI at rest and following ingestion of a high-energy liquid meal. Systemic vascular resistance (SVR) fell substantially and CO rose significantly. Blood pressure remained stable. These changes were predominantly driven by a rapid fall in mesenteric vascular resistance, resulting in over four times more intestinal blood flow. Renal vascular resistance also declined but less dramatically. No changes in blood flow to the celiac territory, the brain, or the limbs were observed. In conclusion, this is the first study to fully characterize systemic and regional changes in vascular resistance after food ingestion in humans. Our findings show that the postprandial drop in SVR is fully compensated for by increased CO and not by redistribution of blood from other organs. With the exception of a modest increase in renal blood flow, there was no evidence of altered blood flow to nondigestive organs. The proposed oral food challenge protocol can be applied safely in an MRI environment and may be useful for studying the involvement of the gut in systemic or cardiovascular disease. © 2016 the American Physiological Society.","Humans; Intestinal; MRI; Postprandial; Vascular resistance","adult; aorta flow; artery blood flow; Article; cardiovascular response; controlled study; female; food intake; heart output; heart ventricle volume; hemodynamic parameters; human; human experiment; intestine blood flow; kidney vascular resistance; male; mesentery blood flow; normal human; nuclear magnetic resonance imaging; postprandial state; priority journal; systemic vascular resistance; adolescent; anatomy and histology; aorta; artery; blood; blood flow; blood vessel; caloric intake; eating; intestine; kidney circulation; middle aged; nuclear magnetic resonance imaging; physiology; vascular resistance; vascularization; young adult; carbon monoxide; Adolescent; Adult; Aorta; Arteries; Blood Vessels; Carbon Monoxide; Eating; Energy Intake; Female; Humans; Intestines; Magnetic Resonance Imaging; Male; Middle Aged; Postprandial Period; Regional Blood Flow; Renal Circulation; Vascular Resistance; Young Adult","Hauser, J.A.; UCL Institute of Cardiovascular Science, 30 Guilford St, United Kingdom; email: jakob.hauser@ucl.ac.uk",,"American Physiological Society",03636119,,AJPRD,"26764056","English","Am. J. Physiol. Regul. Integr. Comp. Physiol.",Article,"Final","All Open Access, Bronze",Scopus,2-s2.0-84984839778
"Taelman L., Bols J., Degroote J., Muthurangu V., Panzer J., Vierendeels J., Segers P.","54975358000;54881002700;24173201400;7801671480;23502419700;7004615890;7005378428;","Differential impact of local stiffening and narrowing on hemodynamics in repaired aortic coarctation: an FSI study",2016,"Medical and Biological Engineering and Computing","54","2-3",,"497","510",,16,"10.1007/s11517-015-1336-1","https://www.scopus.com/inward/record.uri?eid=2-s2.0-84961217705&doi=10.1007%2fs11517-015-1336-1&partnerID=40&md5=d75571b0f4c502b234ab16654e4e045b","IBiTech-bioMMeda, iMinds Medical IT, Ghent University, De Pintelaan 185, Ghent, 9000, Belgium; Department of Flow, Heat and Combustion Mechanics, Ghent University, Sint-Pietersnieuwstraat 41, Ghent, 9000, Belgium; Centre for Cardiovascular MR, UCL Institute of Child Health, London Great Ormond Street Hospital for Children, Great Ormond Street, London, WC1N 3JH, United Kingdom; Paediatric Cardiology, Ghent University Hospital, De Pintelaan 185, Ghent, 9000, Belgium","Taelman, L., IBiTech-bioMMeda, iMinds Medical IT, Ghent University, De Pintelaan 185, Ghent, 9000, Belgium; Bols, J., Department of Flow, Heat and Combustion Mechanics, Ghent University, Sint-Pietersnieuwstraat 41, Ghent, 9000, Belgium; Degroote, J., Department of Flow, Heat and Combustion Mechanics, Ghent University, Sint-Pietersnieuwstraat 41, Ghent, 9000, Belgium; Muthurangu, V., Centre for Cardiovascular MR, UCL Institute of Child Health, London Great Ormond Street Hospital for Children, Great Ormond Street, London, WC1N 3JH, United Kingdom; Panzer, J., Paediatric Cardiology, Ghent University Hospital, De Pintelaan 185, Ghent, 9000, Belgium; Vierendeels, J., Department of Flow, Heat and Combustion Mechanics, Ghent University, Sint-Pietersnieuwstraat 41, Ghent, 9000, Belgium; Segers, P., IBiTech-bioMMeda, iMinds Medical IT, Ghent University, De Pintelaan 185, Ghent, 9000, Belgium","Even after successful treatment of aortic coarctation, a high risk of cardiovascular morbidity and mortality remains. Uncertainty exists on the factors contributing to this increased risk among which are the presence of (1) a residual narrowing leading to an additional resistance and (2) a less distensible zone disturbing the buffer function of the aorta. As the many interfering factors and adaptive physiological mechanisms present in vivo prohibit the study of the isolated impact of these individual factors, a numerical fluid–structure interaction model is developed to predict central hemodynamics in coarctation treatment. The overall impact of a stiffening on the hemodynamics is limited, with a small increase in systolic pressure (up to 8 mmHg) proximal to the stiffening which is amplified with increasing stiffening and length. A residual narrowing, on the other hand, affects the hemodynamics significantly. For a short segment (10 mm), the combination of a stiffening and narrowing (coarctation index 0.5) causes an increase in systolic pressure of 58 mmHg, with 31 mmHg due to narrowing and an additional 27 mmHg due to stiffening. For a longer segment (25 mm), an increase in systolic pressure of 50 mmHg is found, of which only 9 mmHg is due to stiffening. © 2015, International Federation for Medical and Biological Engineering.","End-to-end anastomosis; Fluid–structure interaction; Image-based modeling; Stent","Blood vessels; Physiological models; Additional resistances; Aortic coarctation; End to end; Image-based modeling; Individual factors; Physiological mechanisms; Stent; Structure interactions; Hemodynamics; adult; aorta arch; aorta coarctation; aorta length; aorta pressure; aorta stenosis; arterial stiffness; artery diameter; artery occlusion; Article; ascending aorta; blood vessel parameters; cardiovascular mortality; cardiovascular risk; comparative study; computational fluid dynamics; controlled study; deceleration; descending aorta; disease severity; flow rate; heart function; hemodynamics; human; human experiment; male; mathematical model; morbidity; normal human; pressure gradient; priority journal; scar; systole; systolic blood pressure; aortic coarctation; biological model; pathophysiology; pressure; Adult; Aortic Coarctation; Hemodynamics; Humans; Male; Models, Cardiovascular; Pressure; Vascular Stiffness","Taelman, L.; IBiTech-bioMMeda, De Pintelaan 185, Belgium; email: liesbeth.taelman@ugent.be",,"Springer Verlag",01400118,,MBECD,"26142885","English","Med. Biol. Eng. Comput.",Article,"Final","All Open Access, Green",Scopus,2-s2.0-84961217705
"Kelm M., Goubergrits L., Fernandes J.F., Biocca L., Pongiglione G., Muthurangu V., Khushnood A., Secinaro A., Chinali M., Schubert S., Berger F., Kuehne T., The CARDIOPROOF group","56645997700;6603944840;56511070500;57188292700;6701392210;7801671480;57087011000;53867270200;7801533510;7103116272;7201361048;6603086969;","MRI as a tool for non-invasive vascular profiling: A pilot study in patients with aortic coarctation",2016,"Expert Review of Medical Devices","13","1",,"103","112",,6,"10.1586/17434440.2015.1090309","https://www.scopus.com/inward/record.uri?eid=2-s2.0-84961357066&doi=10.1586%2f17434440.2015.1090309&partnerID=40&md5=9dc4cfb94c68857056a2a76ecbc2bfef","German Heart Institute Berlin, Congenital Heart Diseases - Unit of Cardiovascular Imaging, Augustenburger Platz 1, Berlin, Berlin  13353, Germany; Charité-Universitätsmedizin Berlin, Pediatrics-Pediatric Cardiology, Augustenburger Platz 1, Berlin, 13353, Germany; Charité-Universitaetsmedizin Berlin, Biofluid Mechanics Laboratory, Augustenburger Platz 1, Berlin, Germany; Bambino Gesù Children Hospital, Department of Pediatric Cardiology and Cardiosurgery, Rome, Italy; UCL Institute of Cardiovascular Science, University College, Centre for Cardiovascular Imaging, London, United Kingdom; German Heart Institute Berlin, Congenital Heart Diseases-Heart Catheter Lab., Augustenburger Platz 1, Berlin, Berlin  13353, Germany; German Heart Institute Berlin, Congenital Heart Diseases, Augustenburger Platz 1, Berlin, Berlin  13353, Germany","Kelm, M., German Heart Institute Berlin, Congenital Heart Diseases - Unit of Cardiovascular Imaging, Augustenburger Platz 1, Berlin, Berlin  13353, Germany, Charité-Universitätsmedizin Berlin, Pediatrics-Pediatric Cardiology, Augustenburger Platz 1, Berlin, 13353, Germany; Goubergrits, L., German Heart Institute Berlin, Congenital Heart Diseases - Unit of Cardiovascular Imaging, Augustenburger Platz 1, Berlin, Berlin  13353, Germany, Charité-Universitaetsmedizin Berlin, Biofluid Mechanics Laboratory, Augustenburger Platz 1, Berlin, Germany; Fernandes, J.F., German Heart Institute Berlin, Congenital Heart Diseases - Unit of Cardiovascular Imaging, Augustenburger Platz 1, Berlin, Berlin  13353, Germany; Biocca, L., German Heart Institute Berlin, Congenital Heart Diseases - Unit of Cardiovascular Imaging, Augustenburger Platz 1, Berlin, Berlin  13353, Germany; Pongiglione, G., Bambino Gesù Children Hospital, Department of Pediatric Cardiology and Cardiosurgery, Rome, Italy; Muthurangu, V., UCL Institute of Cardiovascular Science, University College, Centre for Cardiovascular Imaging, London, United Kingdom; Khushnood, A., UCL Institute of Cardiovascular Science, University College, Centre for Cardiovascular Imaging, London, United Kingdom; Secinaro, A., Bambino Gesù Children Hospital, Department of Pediatric Cardiology and Cardiosurgery, Rome, Italy; Chinali, M., Bambino Gesù Children Hospital, Department of Pediatric Cardiology and Cardiosurgery, Rome, Italy; Schubert, S., German Heart Institute Berlin, Congenital Heart Diseases-Heart Catheter Lab., Augustenburger Platz 1, Berlin, Berlin  13353, Germany; Berger, F., German Heart Institute Berlin, Congenital Heart Diseases, Augustenburger Platz 1, Berlin, Berlin  13353, Germany; Kuehne, T., German Heart Institute Berlin, Congenital Heart Diseases - Unit of Cardiovascular Imaging, Augustenburger Platz 1, Berlin, Berlin  13353, Germany; The CARDIOPROOF group","Aim: While the overall concept of aortic coarctation has changed from one of simple obstruction to one that includes significant vascular dysfunction, this has not yet been translated into the diagnostic and treatment process. To close this gap, we sought to demonstrate the usefulness of an additional non-invasive vascular profile. Method: During a pilot study in eight coarctation patients, aortic area compliance, aortic distensibility, time phase shift and blood flow (distribution) were calculated from cine-MRI and 2D-/4D-velocity-encoded MRI sequences. Results: Compared to healthy individuals, a significantly lower aortic compliance and reduced flow to the descending aorta were found in patients with coarctation. Discussion: These differences underline the potential usefulness of a combined vascular profile in coarctation patients. Conclusion: It was successfully shown that functional vascular profiling of the aorta is feasible to be acquired non-invasively in a clinical setting and can provide additional diagnostic information. These can be the key input parameters for computational fluid dynamics-modeling. © 2016 Taylor & Francis.","aortic coarctation; aortic compliance; aortic perfusion; cardiac MRI; catheterization; congenital heart disease; disease modeling; vascular auto-regulation; Windkessel function","Computational fluid dynamics; Diagnosis; Aortic coarctation; Aortic compliance; aortic perfusion; Autoregulations; Cardiac MRI; catheterization; Congenital heart disease; Disease modeling; Windkessel; Blood vessels; iopromide; adolescent; adult; angiography device; aorta coarctation; aorta flow; artery compliance; artery dilatation; Article; blood pressure measurement; child; clinical article; controlled study; descending aorta; female; heart index; human; imaging software; male; non invasive blood pressure monitor; non invasive measurement; nuclear magnetic resonance imaging; nuclear magnetic resonance scanner; pilot study; school child; aorta; aortic coarctation; blood pressure; case control study; compliance (physical); coronary artery blood flow; nuclear magnetic resonance imaging; pathophysiology; procedures; thoracic aorta; time factor; young adult; Adolescent; Adult; Aorta; Aorta, Thoracic; Aortic Coarctation; Blood Pressure; Blood Pressure Determination; Case-Control Studies; Child; Compliance; Coronary Circulation; Female; Humans; Magnetic Resonance Imaging; Male; Pilot Projects; Time Factors; Young Adult","Kelm, M.; German Heart Institute Berlin, Augustenburger Platz 1, Germany; email: mkelm@dhzb.de",,"Taylor and Francis Ltd",17434440,,,"27227178","English","Expert Rev. Med. Devices",Article,"Final","",Scopus,2-s2.0-84961357066
"Ako E.O., Barber N.J., Kowalik G.T., Steeden J.A., Porter J., Walker J.M., Muthurangu V.","56619518000;56609890400;6602362169;36605240600;7403427269;57217636089;7801671480;","MR-augmented cardiopulmonary exercise testing-a proof of concept in sickle cell disease (SCD)",2016,"Journal of Cardiovascular Magnetic Resonance","18",,"O69","1","2",,1,"10.1186/1532-429X-18-S1-O69","https://www.scopus.com/inward/record.uri?eid=2-s2.0-85094827423&doi=10.1186%2f1532-429X-18-S1-O69&partnerID=40&md5=20d70e3ebeb49593d3d0f20a196e369a","The Hatter Cardiovascular Institute, University College London, London, United Kingdom; Great Ormond Street Hospital for Children, Institute of Cardiovascular Science, London, United Kingdom","Ako, E.O., The Hatter Cardiovascular Institute, University College London, London, United Kingdom, Great Ormond Street Hospital for Children, Institute of Cardiovascular Science, London, United Kingdom; Barber, N.J., Great Ormond Street Hospital for Children, Institute of Cardiovascular Science, London, United Kingdom; Kowalik, G.T., Great Ormond Street Hospital for Children, Institute of Cardiovascular Science, London, United Kingdom; Steeden, J.A., Great Ormond Street Hospital for Children, Institute of Cardiovascular Science, London, United Kingdom; Porter, J., The Hatter Cardiovascular Institute, University College London, London, United Kingdom; Walker, J.M., The Hatter Cardiovascular Institute, University College London, London, United Kingdom; Muthurangu, V., Great Ormond Street Hospital for Children, Institute of Cardiovascular Science, London, United Kingdom",[No abstract available],,,"Ako, E.O.; The Hatter Cardiovascular Institute, United Kingdom
Ako, E.O.; Great Ormond Street Hospital for Children, United Kingdom",,"BioMed Central Ltd",10976647,,JCMRF,,"English","J. Cardiovasc. Magn. Reson.",Note,"Final","All Open Access, Gold, Green",Scopus,2-s2.0-85094827423
"Hauser J.A., Muthurangu V., Taylor A., Steeden J.A., Jones A.","37034141400;7801671480;57661576300;36605240600;12795736600;","Redistribution of organ specific blood flow in response to food ingestion measured by R-R-interval averaged golden-angle spiral phase contrast MRI",2016,"Journal of Cardiovascular Magnetic Resonance","18",,"O92","1","2",,,"10.1186/1532-429X-18-S1-O92","https://www.scopus.com/inward/record.uri?eid=2-s2.0-85094809352&doi=10.1186%2f1532-429X-18-S1-O92&partnerID=40&md5=58d38ed2dc402d96b9c2c750aeadb2b3","Institute of Cardiovascular Science, University College London, London, United Kingdom","Hauser, J.A., Institute of Cardiovascular Science, University College London, London, United Kingdom; Muthurangu, V., Institute of Cardiovascular Science, University College London, London, United Kingdom; Taylor, A., Institute of Cardiovascular Science, University College London, London, United Kingdom; Steeden, J.A., Institute of Cardiovascular Science, University College London, London, United Kingdom; Jones, A., Institute of Cardiovascular Science, University College London, London, United Kingdom",[No abstract available],,,"Hauser, J.A.; Institute of Cardiovascular Science, United Kingdom",,"BioMed Central Ltd",10976647,,JCMRF,,"English","J. Cardiovasc. Magn. Reson.",Note,"Final","All Open Access, Gold, Green",Scopus,2-s2.0-85094809352
"Knight D.S., Steeden J.A., Moledina S., Jones A., Coghlan J.G., Muthurangu V.","55589453200;36605240600;23985897400;12795736600;35393553500;7801671480;","Left ventricular diastolic dysfunction in pulmonary hypertension predicts functional capacity and clinical worsening: A tissue phase mapping study",2015,"Journal of Cardiovascular Magnetic Resonance","17","1","116","","",,32,"10.1186/s12968-015-0220-3","https://www.scopus.com/inward/record.uri?eid=2-s2.0-84952315618&doi=10.1186%2fs12968-015-0220-3&partnerID=40&md5=13d8342adb01979afb054181e65ede7c","Centre for Cardiovascular Imaging, UCL Institute of Cardiovascular Science, London, United Kingdom; UCL Medical School, Royal Free Campus, Rowland Hill Street, London, United Kingdom; Centre for Cardiovascular Imaging, UCL Institute of Cardiovascular Science, Institute of Child Health, 30 Guilford Street, London, WC1N 1EH, United Kingdom","Knight, D.S., Centre for Cardiovascular Imaging, UCL Institute of Cardiovascular Science, London, United Kingdom, UCL Medical School, Royal Free Campus, Rowland Hill Street, London, United Kingdom; Steeden, J.A., UCL Medical School, Royal Free Campus, Rowland Hill Street, London, United Kingdom; Moledina, S., UCL Medical School, Royal Free Campus, Rowland Hill Street, London, United Kingdom; Jones, A., UCL Medical School, Royal Free Campus, Rowland Hill Street, London, United Kingdom; Coghlan, J.G., Centre for Cardiovascular Imaging, UCL Institute of Cardiovascular Science, London, United Kingdom; Muthurangu, V., UCL Medical School, Royal Free Campus, Rowland Hill Street, London, United Kingdom, Centre for Cardiovascular Imaging, UCL Institute of Cardiovascular Science, Institute of Child Health, 30 Guilford Street, London, WC1N 1EH, United Kingdom","Background: The function of the right and left ventricles is intimately related through a shared septum and pericardium. Therefore, right ventricular (RV) disease in pulmonary hypertension (PH) can result in abnormal left ventricular (LV) myocardial mechanics. To assess this, we implemented novel cardiovascular magnetic resonance (CMR) tissue phase mapping (TPM) to assess radial, longitudinal and tangential LV myocardial velocities in patients with PH. Methods: Respiratory self-gated TPM was performed using a rotating golden-angle spiral acquisition with retrospective cardiac gating. TPM of a mid ventricular slice was acquired in 40 PH patients and 20 age- and sex-matched healthy controls. Endocardial and epicardial LV borders were manually defined, and myocardial velocities calculated using in-house software. Patients without proximal CTEPH (chronic thromboembolic PH) and not receiving intravenous prostacyclin therapy (n = 34) were followed up until the primary outcome of disease progression (death, transplantation, or progression to intravenous therapy) or the end of the study. Physicians who determined disease progression were blinded to CMR data. Conventional ventricular volumetric indices and novel TPM metrics were analyzed for prediction of 6-min walk distance (6MWD) and disease progression. Results: Peak longitudinal (p < 0.0001) and radial (p = 0.001) early diastolic (E) wave velocities were significantly lower in PH patients compared with healthy volunteers. Reversal of tangential E waves was observed in all patients and was highly discriminative for the presence of PH (p < 0.0001). The global radial E wave (β = 0.41, p = 0.017) and lateral wall radial systolic (S) wave velocities (β = 0.33, p = 0.028) were the only independent predictors of 6MWD in a model including RV ejection fraction (RVEF) and LV stroke volume. Over a median follow-up period of 20 months (IQR 7.9 months), 8 patients commenced intravenous therapy and 1 died. Global longitudinal E wave was the only independent predictor of clinical worsening (6.3× increased risk, p = 0.009) in a model including RVEF and septal curvature. Conclusions: TPM metrics of LV diastolic function are significantly abnormal in PH. More importantly, abnormal LV E wave velocities are the only independent predictors of functional capacity and clinical worsening in a model that includes conventional metrics of biventricular function. © 2015 Knight et al.","Cardiovascular magnetic resonance; Diastolic dysfunction; Pulmonary hypertension","endothelin receptor antagonist; phosphodiesterase V inhibitor; prostacyclin; protein tyrosine kinase inhibitor; adult; Article; cardiac gated imaging; cardiovascular magnetic resonance; chronic thromboembolic pulmonary hypertension; clinical article; controlled study; death; deterioration; disease course; exercise; female; functional status; heart right ventricle ejection fraction; heart stroke volume; human; left ventricular diastolic dysfunction; male; prediction; priority journal; pulmonary hypertension; walking; biomechanics; case control study; computer assisted diagnosis; diastole; feasibility study; heart left ventricle function; heart right ventricle function; Hypertension, Pulmonary; middle aged; mortality; nuclear magnetic resonance imaging; pathophysiology; predictive value; procedures; prognosis; time factor; Adult; Biomechanical Phenomena; Case-Control Studies; Diastole; Disease Progression; Feasibility Studies; Female; Humans; Hypertension, Pulmonary; Image Interpretation, Computer-Assisted; Magnetic Resonance Imaging; Male; Middle Aged; Predictive Value of Tests; Prognosis; Stroke Volume; Time Factors; Ventricular Dysfunction, Left; Ventricular Function, Left; Ventricular Function, Right","Muthurangu, V.; UCL Medical School, Rowland Hill Street, United Kingdom; email: v.muthurangu@ucl.ac.uk",,"BioMed Central Ltd.",10976647,,JCMRF,"26715551","English","J. Cardiovasc. Magn. Reson.",Article,"Final","All Open Access, Gold, Green",Scopus,2-s2.0-84952315618
