"Jones A., McMillan M.R., Jones R.W., Kowalik G.T., Steeden J.A., Deanfield J.E., Pruessner J.C., Taylor A.M., Muthurangu V.","12795736600;55557049300;7501543550;6602362169;36605240600;7004333788;6603802136;57195810900;7801671480;","Adiposity is associated with blunted cardiovascular, neuroendocrine and cognitive responses to acute mental stress",2012,"PLoS ONE","7","6","e39143","","",,48,"10.1371/journal.pone.0039143","https://www.scopus.com/inward/record.uri?eid=2-s2.0-84862651044&doi=10.1371%2fjournal.pone.0039143&partnerID=40&md5=3ca75c7ce5de6ed15b343a6423434304","Centre for Cardiovascular Imaging, UCL Institute of Cardiovascular Science, London, United Kingdom; Chorleywood Health Centre, Chorleywood, United Kingdom; Department of Information Systems and Computing, Brunel University, Uxbridge, United Kingdom; Centre for Cardiovascular Prevention and Outcomes, UCL Institute of Cardiovascular Science, London, United Kingdom; Douglas Institute, Department of Psychiatry, McGill University, Montreal, Canada","Jones, A., Centre for Cardiovascular Imaging, UCL Institute of Cardiovascular Science, London, United Kingdom; McMillan, M.R., Centre for Cardiovascular Imaging, UCL Institute of Cardiovascular Science, London, United Kingdom; Jones, R.W., Chorleywood Health Centre, Chorleywood, United Kingdom, Department of Information Systems and Computing, Brunel University, Uxbridge, United Kingdom; Kowalik, G.T., Centre for Cardiovascular Imaging, UCL Institute of Cardiovascular Science, London, United Kingdom; Steeden, J.A., Centre for Cardiovascular Imaging, UCL Institute of Cardiovascular Science, London, United Kingdom; Deanfield, J.E., Centre for Cardiovascular Prevention and Outcomes, UCL Institute of Cardiovascular Science, London, United Kingdom; Pruessner, J.C., Douglas Institute, Department of Psychiatry, McGill University, Montreal, Canada; Taylor, A.M., Centre for Cardiovascular Imaging, UCL Institute of Cardiovascular Science, London, United Kingdom; Muthurangu, V., Centre for Cardiovascular Imaging, UCL Institute of Cardiovascular Science, London, United Kingdom","Obesity and mental stress are potent risk factors for cardiovascular disease but their relationship with each other is unclear. Resilience to stress may differ according to adiposity. Early studies that addressed this are difficult to interpret due to conflicting findings and limited methods. Recent advances in assessment of cardiovascular stress responses and of fat distribution allow accurate assessment of associations between adiposity and stress responsiveness. We measured responses to the Montreal Imaging Stress Task in healthy men (N = 43) and women (N = 45) with a wide range of BMIs. Heart rate (HR) and blood pressure (BP) measures were used with novel magnetic resonance measures of stroke volume (SV), cardiac output (CO), total peripheral resistance (TPR) and arterial compliance to assess cardiovascular responses. Salivary cortisol and the number and speed of answers to mathematics problems in the task were used to assess neuroendocrine and cognitive responses, respectively. Visceral and subcutaneous fat was measured using T2*-IDEAL. Greater BMI was associated with generalised blunting of cardiovascular (HR:β = -0.50 bpm.unit-1, P = 0.009; SV:β = -0.33 mL.unit-1, P = 0.01; CO:β = -61 mL.min-1.unit-1, P = 0.002; systolic BP:β = -0.41 mmHg.unit-1, P = 0.01; TPR:β = 0.11 WU.unit-1, P = 0.02), cognitive (correct answers: r = -0.28, P = 0.01; time to answer: r = 0.26, P = 0.02) and endocrine responses (cortisol: r = -0.25, P = 0.04) to stress. These associations were largely determined by visceral adiposity except for those related to cognitive performance, which were determined by both visceral and subcutaneous adiposity. Our findings suggest that adiposity is associated with centrally reduced stress responsiveness. Although this may mitigate some long-term health risks of stress responsiveness, reduced performance under stress may be a more immediate negative consequence. © 2012 Jones et al.",,"hydrocortisone; adult; artery compliance; article; blood pressure measurement; body mass; cardiovascular response; cognition; controlled study; disease association; female; heart output; heart rate; heart stroke volume; hormone release; human; human tissue; intraabdominal fat; major clinical study; male; mathematical analysis; mental stress; neuroendocrine system; nuclear magnetic resonance imaging; obesity; subcutaneous fat; vascular resistance; Adiposity; Adolescent; Adult; Blood Pressure; Cardiac Output; Cardiovascular System; Cognition; Female; Heart Rate; Humans; Male; Middle Aged; Stress, Psychological; Young Adult","Jones, A.; Centre for Cardiovascular Imaging, , London, United Kingdom; email: alex.jones@ucl.ac.uk",,,19326203,,,"22745709","English","PLoS ONE",Article,"Final","All Open Access, Gold, Green",Scopus,2-s2.0-84862651044
"Odenwald T., Quail M.A., Giardini A., Khambadkone S., Hughes M., Tann O., Hsia T.-Y., Muthurangu V., Taylor A.M.","12798341800;35380885000;7006043205;6603345564;7402467863;24339325500;54883432300;7801671480;57195810900;","Systemic to pulmonary collateral blood flow influences early outcomes following the total cavopulmonary connection",2012,"Heart","98","12",,"934","940",,46,"10.1136/heartjnl-2011-301599","https://www.scopus.com/inward/record.uri?eid=2-s2.0-84861519210&doi=10.1136%2fheartjnl-2011-301599&partnerID=40&md5=4c333c23c4a910d3781d86cf24e9752f","Centre for Cardiovascular Imaging, UCL Institute of Cardiovascular Science, Great Ormond Street Hospital for Children, London, United Kingdom; Cardiorespiratory Unit, Great Ormond Street Hospital for Children, Old Nurses Home, Great Ormond Street, London WC1N 3JH, United Kingdom","Odenwald, T., Centre for Cardiovascular Imaging, UCL Institute of Cardiovascular Science, Great Ormond Street Hospital for Children, London, United Kingdom; Quail, M.A., Centre for Cardiovascular Imaging, UCL Institute of Cardiovascular Science, Great Ormond Street Hospital for Children, London, United Kingdom, Cardiorespiratory Unit, Great Ormond Street Hospital for Children, Old Nurses Home, Great Ormond Street, London WC1N 3JH, United Kingdom; Giardini, A., Cardiorespiratory Unit, Great Ormond Street Hospital for Children, Old Nurses Home, Great Ormond Street, London WC1N 3JH, United Kingdom; Khambadkone, S., Cardiorespiratory Unit, Great Ormond Street Hospital for Children, Old Nurses Home, Great Ormond Street, London WC1N 3JH, United Kingdom; Hughes, M., Centre for Cardiovascular Imaging, UCL Institute of Cardiovascular Science, Great Ormond Street Hospital for Children, London, United Kingdom; Tann, O., Centre for Cardiovascular Imaging, UCL Institute of Cardiovascular Science, Great Ormond Street Hospital for Children, London, United Kingdom; Hsia, T.-Y., Cardiorespiratory Unit, Great Ormond Street Hospital for Children, Old Nurses Home, Great Ormond Street, London WC1N 3JH, United Kingdom; Muthurangu, V., Centre for Cardiovascular Imaging, UCL Institute of Cardiovascular Science, Great Ormond Street Hospital for Children, London, United Kingdom; Taylor, A.M., Centre for Cardiovascular Imaging, UCL Institute of Cardiovascular Science, Great Ormond Street Hospital for Children, London, United Kingdom","Background: Systemic to pulmonary collaterals (SPCs) represent an additional and unpredictable source of pulmonary blood flow in patients with single ventricle physiology following bidirectional superior cavopulmonary connection (BCPC). Understanding their influence on patient outcomes has been hampered by uncertainty about the optimal method of quantifying SPC flow. Objective: To quantify SPC flow by cardiac magnetic resonance (CMR) prior to total cavopulmonary connection (TCPC) in order to identify preoperative risk factors and determine influence on postoperative outcomes. Design: Single centre prospective cohort study. Setting: Tertiary referral centre. Patients: 65 patients with single ventricle physiology undergoing CMR for preoperative assessment of TCPC completion underwent quantification of SPC flow. Clinical outcomes of 41 patients in whom TCPC was completed were obtained. Main outcome measures: Early post-TCPC clinical outcomes associated with SPC flow were assessed, including postoperative chest drainage volume, postoperative chest drainage duration and length of intensive care and hospital stays. Additionally preoperative covariates associated with SPC flow were assessed including age at BCPC and CMR, SpO 2 at BCPC and CMR, ventricle type, pulmonary artery (PA) crosssectional area and PA pulsatility. Different methods of CMR SPC flow quantification were compared. Results: Higher SPC flow was associated with increased postoperative chest drain volume (r=0.51, p=0.001), chest drain duration (r=0.43, p=0.005), and intensive care unit (r=0.32, p=0.04) and log-transformed hospital stays (r=0.31, p=0.048). The effect of SPC flow on outcome was independent of fenestration, ventricle type and function. Preoperative covariates associated with SPC flow included age at BCPC (β=-0.34, p=0.008), SpO 2 at time of CMR (β=0.34, p=0.004) and branch PA cross-sectional area (β=-0.26, p=0.036), model R 2=0.34. Moreover, patients with pulsatile pulmonary blood flow had lower SPC flow than those without (0.8 vs 1.3 l/min/m 2 p=0.012). SPC flow calculated by the difference between pulmonary venous return and pulmonary artery flow (l/min/m 2) showed greatest association with preoperative covariates and strongest correlation with postoperative outcomes compared with other methods of quantification. Conclusions: CMR can provide an effective measurement of SPC flow prior to TCPC. Young age at BCPC, high preoperative oxygen saturation and smaller PAs are associated with increased SPC flow, which may promote increased postoperative pleural drainage and lengthen recovery.",,"age distribution; article; cardiovascular magnetic resonance; cardiovascular risk; cavopulmonary connection; cohort analysis; controlled clinical trial; controlled study; cross-sectional study; female; heart left ventricle function; heart ventricle; hospitalization; human; human cell; human tissue; intensive care; lung blood vessel; major clinical study; male; outcome assessment; oxygen saturation; postoperative period; preoperative period; priority journal; pulmonary artery; systemic pulmonary collateral blood flow; thorax drainage; treatment duration; Anastomosis, Surgical; Blood Flow Velocity; Cardiac Surgical Procedures; Child, Preschool; Collateral Circulation; Female; Follow-Up Studies; Fontan Procedure; Heart Defects, Congenital; Humans; Infant; Magnetic Resonance Angiography; Male; Prospective Studies; Pulmonary Artery; Pulmonary Circulation; Treatment Outcome","Quail, M.A.; Cardiorespiratory Unit, Great Ormond Street, London WC1N 3JH, United Kingdom; email: m.quail@ucl.ac.uk",,,13556037,,HEARF,"22626901","English","Heart",Article,"Final","",Scopus,2-s2.0-84861519210
"Quail M.A., Muthurangu V., Taylor A.M.","35380885000;7801671480;57195810900;","Tetralogy of fallot",2012,"Magnetic Resonance Imaging of Congenital Heart Disease","9781447142676",,,"119","132",,,"10.1007/978-1-4471-4267-6_7","https://www.scopus.com/inward/record.uri?eid=2-s2.0-84929032605&doi=10.1007%2f978-1-4471-4267-6_7&partnerID=40&md5=df5a56234446f5566699d37a894a7aed","Pediatric Cardiology, Centre for Cardiovascular Imaging, UCL Institute of Cardiovascular Sciences and Great Ormond Street Hospital for Children, Great Ormond Street, London, United Kingdom; UCL Centre for Cardiovascular MR, University College London, 30 Guildford Street, London, United Kingdom; Cardio-Respiratory Unit, UCL Institute of Child Health and Great Ormond Street Hospital for Children, Great Ormond Street, London, United Kingdom","Quail, M.A., Pediatric Cardiology, Centre for Cardiovascular Imaging, UCL Institute of Cardiovascular Sciences and Great Ormond Street Hospital for Children, Great Ormond Street, London, United Kingdom; Muthurangu, V., UCL Centre for Cardiovascular MR, University College London, 30 Guildford Street, London, United Kingdom; Taylor, A.M., Cardio-Respiratory Unit, UCL Institute of Child Health and Great Ormond Street Hospital for Children, Great Ormond Street, London, United Kingdom","Tetralogy of Fallot (TOF) is the most common form of cyanotic congenital heart disease, occurring in 1 in 3,600 live births [1]. Complete repair of TOF was devised over 50 years ago (first reported by Lillehei in 1954) and can result in complete intra-cardiac repair in early infancy [2]. However, despite excellent short- and medium-term survival rates, the 30 year actuarial survival for patients repaired before their 5th birthday is 90 % of the expected survival rate and the annualized risk of death triples in the third postoperative decade [2, 3]. Late morbidity and mortality, in particular related to pulmonary incompetence, has been observed in many patients long after total repair. © Springer-Verlag London 2012. All rights are reserved.",,"Repair; Cardiac repair; Congenital heart disease; Medium term; Survival rate; Tetralogy of Fallot; Diseases","Quail, M.A.; Pediatric Cardiology, Great Ormond Street, United Kingdom",,"Springer-Verlag London Ltd",,9781447142676; 1447142667; 9781447142669,,,"English","Magnetic Reson. Imaging of Coigenit. Heart Dis.",Book Chapter,"Final","",Scopus,2-s2.0-84929032605
"Muthurangu V., Tann O.R., Taylor A.M.","7801671480;24339325500;57195810900;","Interventional cardiovascular magnetic resonance",2012,"Magnetic Resonance Imaging of Congenital Heart Disease","9781447142676",,,"293","301",,,"10.1007/978-1-4471-4267-6_18","https://www.scopus.com/inward/record.uri?eid=2-s2.0-84929024896&doi=10.1007%2f978-1-4471-4267-6_18&partnerID=40&md5=f79708412c840951c6f8d5b690b39164","UCL Centre for Cardiovascular MR, University College London, 30 Guildford Street, London, United Kingdom; Cardio-Respiratory Unit, Great Ormond Street Hospital, Great Ormond Street, London, United Kingdom; Cardio-Respiratory Unit, UCL, Institute of Child Health and Great Ormond Street Hospital for Children, Great Ormond Street, London, United Kingdom","Muthurangu, V., UCL Centre for Cardiovascular MR, University College London, 30 Guildford Street, London, United Kingdom; Tann, O.R., Cardio-Respiratory Unit, Great Ormond Street Hospital, Great Ormond Street, London, United Kingdom; Taylor, A.M., Cardio-Respiratory Unit, UCL, Institute of Child Health and Great Ormond Street Hospital for Children, Great Ormond Street, London, United Kingdom","Cardiac magnetic resonance (CMR) is increasingly replacing diagnostic cardiac catheterization as a method of assessing cardiac anatomy, measuring blood flow and quantifying ventricular function. Nevertheless, interventional cardiac catheterization is a growth area in congenital heart disease. Furthermore, diagnostic cardiac catheterization is still necessary when intra-cardiac or intra-vascular pressure measurements are necessary. Currently, X-ray fluoroscopy is the imaging modality of choice for guiding cardiac catheterization with some interventions also utilizing echocardiography. However, there are problems with this approach and the use of MR during catheterization may be able to solve them. In this chapter the role of MR in the catheterization laboratory, both for guidance and cardiac assessment, will be reviewed. By the end of this chapter the reader should have a greater understanding of the current state and future possibilities of interventional cardiac MR. © Springer-Verlag London 2012. All rights are reserved.",,"Blood pressure; Echocardiography; Heart; Cardiac anatomy; Cardiac catheterizations; Cardiac magnetic resonance; Cardiovascular magnetic resonances; Congenital heart disease; Imaging modality; Ventricular functions; X-ray fluoroscopy; Magnetic resonance","Muthurangu, V.; UCL Centre for Cardiovascular MR, 30 Guildford Street, United Kingdom",,"Springer-Verlag London Ltd",,9781447142676; 1447142667; 9781447142669,,,"English","Magnetic Reson. Imaging of Coigenit. Heart Dis.",Book Chapter,"Final","",Scopus,2-s2.0-84929024896
"Puranik R., Tsang V., Lurz P., Muthurangu V., Offen S., Frigiola A., Norman W., Walker F., Bonhoeffer P., Taylor A.M.","11139015400;56466227600;35810676500;7801671480;53983232600;57204096696;57218666629;13906244100;7007022476;57195810900;","Long-term importance of right ventricular outflow tract patch function in patients with pulmonary regurgitation",2012,"Journal of Thoracic and Cardiovascular Surgery","143","5",,"1103","1107",,28,"10.1016/j.jtcvs.2011.09.039","https://www.scopus.com/inward/record.uri?eid=2-s2.0-84859755227&doi=10.1016%2fj.jtcvs.2011.09.039&partnerID=40&md5=83d827539f261a37e9ee1b7c2d45cff6","Centre for Cardiovascular Imaging, UCL Institute of Cardiovascular Science, Great Ormond Street Hospital for Children, Great Ormond St, London WC1N 3JH, United Kingdom; Cardiorespiratory Unit, Great Ormond Street Hospital for Children, London, United Kingdom; GURCH Unit, Heart Hospital, London, United Kingdom","Puranik, R., Centre for Cardiovascular Imaging, UCL Institute of Cardiovascular Science, Great Ormond Street Hospital for Children, Great Ormond St, London WC1N 3JH, United Kingdom, Cardiorespiratory Unit, Great Ormond Street Hospital for Children, London, United Kingdom; Tsang, V., Cardiorespiratory Unit, Great Ormond Street Hospital for Children, London, United Kingdom, GURCH Unit, Heart Hospital, London, United Kingdom; Lurz, P., Centre for Cardiovascular Imaging, UCL Institute of Cardiovascular Science, Great Ormond Street Hospital for Children, Great Ormond St, London WC1N 3JH, United Kingdom, Cardiorespiratory Unit, Great Ormond Street Hospital for Children, London, United Kingdom; Muthurangu, V., Centre for Cardiovascular Imaging, UCL Institute of Cardiovascular Science, Great Ormond Street Hospital for Children, Great Ormond St, London WC1N 3JH, United Kingdom, Cardiorespiratory Unit, Great Ormond Street Hospital for Children, London, United Kingdom; Offen, S., Centre for Cardiovascular Imaging, UCL Institute of Cardiovascular Science, Great Ormond Street Hospital for Children, Great Ormond St, London WC1N 3JH, United Kingdom; Frigiola, A., Centre for Cardiovascular Imaging, UCL Institute of Cardiovascular Science, Great Ormond Street Hospital for Children, Great Ormond St, London WC1N 3JH, United Kingdom, Cardiorespiratory Unit, Great Ormond Street Hospital for Children, London, United Kingdom, GURCH Unit, Heart Hospital, London, United Kingdom; Norman, W., Centre for Cardiovascular Imaging, UCL Institute of Cardiovascular Science, Great Ormond Street Hospital for Children, Great Ormond St, London WC1N 3JH, United Kingdom; Walker, F., GURCH Unit, Heart Hospital, London, United Kingdom; Bonhoeffer, P., Centre for Cardiovascular Imaging, UCL Institute of Cardiovascular Science, Great Ormond Street Hospital for Children, Great Ormond St, London WC1N 3JH, United Kingdom; Taylor, A.M., Centre for Cardiovascular Imaging, UCL Institute of Cardiovascular Science, Great Ormond Street Hospital for Children, Great Ormond St, London WC1N 3JH, United Kingdom, Cardiorespiratory Unit, Great Ormond Street Hospital for Children, London, United Kingdom","Objective: Chronic pulmonary regurgitation (PR) has deleterious effects on right ventricular (RV) function in repaired tetralogy of Fallot (ToF). However, there are little data regarding right ventricular outflow tract (RVOT) contractile dysfunction in response to chronic PR and on both RV and LV volumes and function. Methods: We retrospectively identified consecutive patients with PR who were referred for magnetic resonance imaging quantification of ""free PR"" detected on echocardiography between 2003 and 2008. Patients had ToF and a transannular patch procedure (n = 30, 25.1 ± 1.2 years) or PR resulting from valvar pulmonary stenosis treated with surgical or percutaneous valvotomy (n = 30, 26.6 ± 1.8 years). Results: The ToF and the PS groups were well matched for age at scan, age at repair surgery in ToF or initial valvotomy in PS, duration of exposure to PR, body surface area, heart rate, PR fraction, net forward pulmonary artery flow, and main and branch pulmonary artery dimensions. Severe PR fractions were identified in both groups (ToF: 40% ± 1% vs PS: 37% ± 2%, P = .2). Indexed RV and LV end-diastolic volumes were similar for both ToF and PS groups (RV end-diastolic volume index: 137 ± 6 mL/m 2 vs 128 ± 5 mL/m 2, P = .2, and LV end-diastolic volume index: 72 ± 2 mL/m 2 vs 67 ± 2 mL/m 2, P = .1, respectively). RV mass was also similar between groups (95 ± 5 g vs 81 ± 6 g, respectively, P = .08). However, indexed RV and LV end-systolic volumes were consistently higher in ToF when compared with PS (RV end-systolic volume index: 70 ± 5 mL/m 2 vs 54 ± 3 mL/m 2, P &lt; .01, and LV end-systolic volume index: 29 ± 1 mL/m 2 vs 22 ± 1 mL/m 2, P &lt; .01, respectively). These changes were reflected in lower biventricular systolic function in patients with ToF when compared with PS (RV ejection fraction: 52% ± 1.5% vs 59% ± 1%, P &lt; .001, and LV ejection fraction: 61% ± 1% vs 67 ± 1%, P &lt; .001, respectively). Although RV transannular plane systolic excursion was not significantly different between the groups (P = .86), the RV outflow tract was considered contractile in only 50% of patients with ToF compared with 93% of patients with PS (P = .0004). RV volumes and function were similar when only patients with contractile RV outflow tracts were compared. Conclusions: RV outflow tract patch dysfunction in repaired ToF is responsible for higher end-systolic volumes and thus lower global measures of ventricular systolic function. These findings were not evident in cases of PS treated with valvotomy with comparable amount of PR. These observations highlight the importance of the initial repair surgery in ToF for late outcomes. Copyright © 2012 by The American Association for Thoracic Surgery.",,"adult; artery blood flow; article; body surface; cardiovascular magnetic resonance; echocardiography; Fallot tetralogy; female; heart left ventricle ejection fraction; heart left ventricle enddiastolic volume; heart rate; heart right ventricle ejection fraction; heart right ventricle enddiastolic volume; heart right ventricle function; heart right ventricle outflow tract; human; major clinical study; male; priority journal; pulmonary valve insufficiency; pulmonary valve stenosis; pulmonary valvuloplasty; retrospective study; three dimensional imaging; transluminal valvuloplasty; Adult; Cardiac Surgical Procedures; Chronic Disease; Female; Humans; London; Magnetic Resonance Imaging; Male; Pulmonary Circulation; Pulmonary Valve Insufficiency; Pulmonary Valve Stenosis; Retrospective Studies; Stroke Volume; Systole; Tetralogy of Fallot; Time Factors; Treatment Outcome; Ventricular Function, Left; Ventricular Function, Right; Ventricular Outflow Obstruction; Young Adult","Taylor, A.M.; Centre for Cardiovascular Imaging, Great Ormond St, London WC1N 3JH, United Kingdom; email: a.taylor76@ucl.ac.uk",,,00225223,,JTCSA,"22056367","English","J. Thorac. Cardiovasc. Surg.",Article,"Final","All Open Access, Bronze",Scopus,2-s2.0-84859755227
